Tweet ID,Date Created,Tweet,Clean_tweet,Polarity,Subjectivity,Retweets,Favorites,Language,User ID,User Name,User Twitter Handle,Follower Count,Friend Count,Location,Verified
1101073830360027136,2019-02-28,@alexisohanian @reddit Thanks Alexis - hope you’re doing great.  Sure seems like it.  😀👍,Thanks Alexis hope doing great Sure seems like,0.5,0.6129629629629629,3,27,en,2228878592,Andrew Yang,AndrewYang,292213,4707,USA,True
1100955425971863552,2019-02-28,RT @PotionWaveTV: This new self-driving floor cleaner in my local Walmart just goes to show exactly why you need to pay attention to what @…,This self driving floor cleaner local Walmart just goes show exactly need attention what,0.125,0.125,203,0,en,2228878592,Andrew Yang,AndrewYang,292213,4707,USA,True
1100924549313511425,2019-02-28,RT @marwilliamson: 30 min to go! Join my Citizen Campaign Call with @AndrewYangVFA. Details here: https://t.co/tseM8INLps https://t.co/JaVv…,Join Citizen Campaign Call with Details here tseM INLps JaVv,0.296,0.0,37,0,en,2228878592,Andrew Yang,AndrewYang,292213,4707,USA,True
1100900398133665792,2019-02-27,Doing a Reddit AMA tomorrow on r/politics at 2:30 p.m. EST. Come join and ask lots of questions. Fun 🙂 👍,Doing Reddit tomorrow politics Come join lots questions,0.296,0.0,226,1388,en,2228878592,Andrew Yang,AndrewYang,292213,4707,USA,True
1100884387485442048,2019-02-27,My recent trip to Ohio and New Hampshire produced some of the biggest crowds of the campaign  https://t.co/UPE64jW3RI met many amazing people 👍🇺🇸 be back soon,recent trip Ohio Hampshire produced some biggest crowds campaign many amazing people back soon,0.275,0.4125,40,309,en,2228878592,Andrew Yang,AndrewYang,292213,4707,USA,True
1100875806388162566,2019-02-27,RT @TrustlessState: I'm supporting @AndrewYangVFA for president! Join our fight for humanity and let's build a movement to get him elected.…,supporting president Join fight humanity build movement elected,0.25,0.25,30,0,en,2228878592,Andrew Yang,AndrewYang,292213,4707,USA,True
1100874087914786816,2019-02-27,I learned a ton from Scott - man got himself a Universal Basic Income and now shares his learnings with folks like me.  Thank you Scott.  👍🙏 https://t.co/mg0xSaRgKd,learned from Scott himself Universal Basic Income shares learnings with folks like Thank Scott xSaRgKd,0.7351,0.0625,99,454,en,2228878592,Andrew Yang,AndrewYang,292213,4707,USA,True
1100866533381885953,2019-02-27,@scottsantens Thanks Scott.  👍,Thanks Scott,0.2,0.2,1,57,en,2228878592,Andrew Yang,AndrewYang,292213,4707,USA,True
1100842402724569089,2019-02-27,@TheSeguraShow Mostly no.  People and dividend portable and still price sensitive.,Mostly People dividend portable still price sensitive,0.3,0.7,0,3,en,2228878592,Andrew Yang,AndrewYang,292213,4707,USA,True
1100838823536328704,2019-02-27,"Thank you all for the incredible support. We're hiring an Executive Assistant on the campaign.  Can be remote or in NYC, check out the job description here:

https://t.co/VhDsDvXZtK",Thank incredible support hiring Executive Assistant campaign remote check description here VhDsDvXZtK,0.4,0.55,63,365,en,2228878592,Andrew Yang,AndrewYang,292213,4707,USA,True
1100822079929311234,2019-02-27,@MorphingReality @rettiwtHD @CarlosDanger024 @JamesRobichaux @aliamjadrizvi Every consumer-facing business would have customers with much greater purchasing power.,Every consumer facing business would have customers with much greater purchasing power,0.5,0.5,1,13,en,2228878592,Andrew Yang,AndrewYang,292213,4707,USA,True
1100812593013379072,2019-02-27,@rikitanone Yes slight delay,slight delay,-0.16666666666666666,0.16666666666666666,0,2,en,2228878592,Andrew Yang,AndrewYang,292213,4707,USA,True
1100809123963260928,2019-02-27,@nortondirector Thank you 👍,Thank,0.3612,0.0,0,7,en,2228878592,Andrew Yang,AndrewYang,292213,4707,USA,True
1100801159483269120,2019-02-27,I get emotional about facts.,emotional about facts,0.1531,0.65,377,2716,en,2228878592,Andrew Yang,AndrewYang,292213,4707,USA,True
1100800935222218754,2019-02-27,@CapitolRomance I believe there are multiple strands - but I think the economic backdrop is crucial myself.  Having worked in the Midwest and the South things are not going well for many many people.,believe there multiple strands think economic backdrop crucial myself Having worked Midwest South things going well many many people,0.24,0.44000000000000006,0,2,en,2228878592,Andrew Yang,AndrewYang,292213,4707,USA,True
1100798340776816640,2019-02-27,"If you look at the voter district data, there is a straight line up between the adoption of industrial robots in that district and the movement towards Trump. We blasted away 4 million manufacturing jobs in Ohio, Michigan and other swing states and Donald Trump is our president. https://t.co/S5aMIO2aiY",look voter district data there straight line between adoption industrial robots that district movement towards Trump blasted away million manufacturing jobs Ohio Michigan other swing states Donald Trump president aMIO,-0.17499999999999996,0.5583333333333333,246,766,en,2228878592,Andrew Yang,AndrewYang,292213,4707,USA,True
1100796411132735488,2019-02-27,"@miha400 Positive.  I like EITC too.  Prefer Dividend because of universality, timing of payments and administration.",Positive like EITC Prefer Dividend because universality timing payments administration,0.22727272727272727,0.5454545454545454,4,18,en,2228878592,Andrew Yang,AndrewYang,292213,4707,USA,True
1100795771463630850,2019-02-27,It feels great knowing you’re doing exactly what you’re supposed to be doing.  I want more people to have this feeling.  Let’s do it.,feels great knowing doing exactly what supposed doing want more people have this feeling,0.5166666666666667,0.5,78,651,en,2228878592,Andrew Yang,AndrewYang,292213,4707,USA,True
1100786935939895297,2019-02-27,Thank you Marianne - you are a true leader.  👍 https://t.co/HQAHNknZAc,Thank Marianne true leader HQAHNknZAc,0.35,0.65,37,244,en,2228878592,Andrew Yang,AndrewYang,292213,4707,USA,True
1100785804769669120,2019-02-27,I occasionally think of the other Andrew Yangs out there.  I hope I have their support.  😀,occasionally think other Andrew Yangs there hope have their support,-0.0625,0.25,58,1081,en,2228878592,Andrew Yang,AndrewYang,292213,4707,USA,True
1100779943632519168,2019-02-27,I think things can get worse.  I also think they can get better.  Unfortunately one is the path of least resistance.  The other will require us to fight for it very very hard.  👍🥊🇺🇸,think things worse also think they better Unfortunately path least resistance other will require fight very very hard,-0.20069444444444443,0.5965277777777778,135,765,en,2228878592,Andrew Yang,AndrewYang,292213,4707,USA,True
1100779122123554817,2019-02-27,@TOak14 @PhilllChabbb @PodSaveAmerica @PeteButtigieg @CNN @MSNBC @CNN may be about to catch up 👍,about catch,0.0,0.0,1,12,en,2228878592,Andrew Yang,AndrewYang,292213,4707,USA,True
1100772078045851648,2019-02-27,@ReasonRaccoon @gocannow When I’m President I’ll use real numbers 👍,When President real numbers,0.2,0.30000000000000004,3,34,en,2228878592,Andrew Yang,AndrewYang,292213,4707,USA,True
1100771501178056704,2019-02-27,@StevePikelny I like the vision and priorities,like vision priorities,0.5423,0.0,0,2,en,2228878592,Andrew Yang,AndrewYang,292213,4707,USA,True
1100771073933672453,2019-02-27,@ConSulInsurance 65k.  Had 15k coming in.  👍,coming,0.0,0.0,1,6,en,2228878592,Andrew Yang,AndrewYang,292213,4707,USA,True
1100769852577509376,2019-02-27,"The automation of labor has been going on for years. We automated away 4 million manufacturing jobs starting in 2000. Many of those workers left the workforce and our labor participation rate dropped. Today it is around 63.2%, near a multi-decade low and the same as Ecuador. https://t.co/HRfcSIzfqd",automation labor been going years automated away million manufacturing jobs starting Many those workers left workforce labor participation rate dropped Today around near multi decade same Ecuador HRfcSIzfqd,0.12,0.225,154,385,en,2228878592,Andrew Yang,AndrewYang,292213,4707,USA,True
1100766097597497344,2019-02-27,@TaraWisdomeyes @Crew_9_6 @ewarren I like Elizabeth Warren.  Have people in common.,like Elizabeth Warren Have people common,-0.3,0.5,0,5,en,2228878592,Andrew Yang,AndrewYang,292213,4707,USA,True
1100765741635260424,2019-02-27,"33,500.  That was fast.  Should I keep updating now that there is a progress-meter on the website?  Sure!  😀👍",That fast Should keep updating that there progress meter website Sure,0.35,0.7444444444444445,46,857,en,2228878592,Andrew Yang,AndrewYang,292213,4707,USA,True
1100765093128744961,2019-02-27,@flubstone Not really,really,0.2,0.2,0,3,en,2228878592,Andrew Yang,AndrewYang,292213,4707,USA,True
1100764883849801728,2019-02-27,@IanJPennebaker Sooner,Sooner,0.0,0.0,0,12,en,2228878592,Andrew Yang,AndrewYang,292213,4707,USA,True
1100762627842760704,2019-02-27,@FirethorneScott Past mismanagement does not mean we don’t have the resources.  We very much do.  The economy is up to a record $20 trillion up $5 trillion in the past 12 years. The Freedom Dividend will be spent here and circulate throughout the economy.,Past mismanagement does mean have resources very much economy record trillion trillion past years Freedom Dividend will spent here circulate throughout economy,-0.1305,0.3095,1,28,en,2228878592,Andrew Yang,AndrewYang,292213,4707,USA,True
1100761703778787328,2019-02-27,There is nothing stopping the majority of citizens of a democracy from declaring ourselves a dividend.  When people start realizing this we will change the course of history.  It will happen faster than most think possible.,There nothing stopping majority citizens democracy from declaring ourselves dividend When people start realizing this will change course history will happen faster than most think possible,0.25,0.75,143,790,en,2228878592,Andrew Yang,AndrewYang,292213,4707,USA,True
1100759404465582080,2019-02-27,"RT @jbrownsc: @AndrewYangVFA's Reddit AMA is scheduled for Thursday, February 28th @ 11:30am Pacific on r/Politics.  #Yang2020 #HumanityFir…",Reddit scheduled Thursday February Pacific Politics #Yang #HumanityFir,0.0,0.0,28,0,en,2228878592,Andrew Yang,AndrewYang,292213,4707,USA,True
1100741644067004422,2019-02-27,@veganboyscout Thanks Brett 👍,Thanks Brett,0.2,0.2,0,4,en,2228878592,Andrew Yang,AndrewYang,292213,4707,USA,True
1100741370132742146,2019-02-27,@Narratweetor Regional inequality and financial insecurity - moving takes resources.  Many can’t move because they are underwater on a mortgage or house that has lost value.,Regional inequality financial insecurity moving takes resources Many move because they underwater mortgage house that lost value,0.25,0.25,0,13,en,2228878592,Andrew Yang,AndrewYang,292213,4707,USA,True
1100740637563985920,2019-02-27,"@JakeTheHuman28 @MarkDav84922774 For the Paris Accords, carbon fee and dividend, investing hundreds of billions in more sustainable and resilient infrastructure, and agree that climate change is an existential threat to our way of life and must be addressed as soon as possible.",Paris Accords carbon dividend investing hundreds billions more sustainable resilient infrastructure agree that climate change existential threat life must addressed soon possible,0.25,0.75,2,8,en,2228878592,Andrew Yang,AndrewYang,292213,4707,USA,True
1100740089473323008,2019-02-27,@173__173 Sure 👍,Sure,0.5,0.8888888888888888,0,5,en,2228878592,Andrew Yang,AndrewYang,292213,4707,USA,True
1100734278315454465,2019-02-27,The annual rate of interstate relocation has dropped from 3.6% of the population in 1970 to 1.6% in recent years. This is the opposite of what you’d want in a dynamic economy. We should help more Americans move for work - it’s good for them and the economy https://t.co/fd11d700fN,annual rate interstate relocation dropped from population recent years This opposite what want dynamic economy should help more Americans move work good them economy,0.24,0.30333333333333334,66,323,en,2228878592,Andrew Yang,AndrewYang,292213,4707,USA,True
1100627409408282630,2019-02-27,@Fladeboe Thanks Andrew,Thanks Andrew,0.2,0.2,0,7,en,2228878592,Andrew Yang,AndrewYang,292213,4707,USA,True
1100624908978216960,2019-02-27,@j0hnspencer Going to be rough - let’s fight for a better future together.  👍,Going rough fight better future together,0.13333333333333333,0.3416666666666666,2,33,en,2228878592,Andrew Yang,AndrewYang,292213,4707,USA,True
1100623450358599680,2019-02-27,@_James_Elmore Glad you did 👍,Glad,0.5,1.0,0,5,en,2228878592,Andrew Yang,AndrewYang,292213,4707,USA,True
1100623196154417153,2019-02-27,The problem is that we need work - and a lot of work won’t need us.,problem that need work work need,-0.4019,0.0,221,1195,en,2228878592,Andrew Yang,AndrewYang,292213,4707,USA,True
1100611347778359298,2019-02-27,@SisiLiliDidi @Superxack Thank you for this!  😀🙏,Thank this,0.3612,0.0,2,25,en,2228878592,Andrew Yang,AndrewYang,292213,4707,USA,True
1100611284993826816,2019-02-27,"RT @SisiLiliDidi: #yang2020 What would people do if our future President @AndrewYangVFA provides #freedomdividend $1,000 a month to every U…",#yang What would people future President provides #freedomdividend month every,0.0,0.125,41,0,en,2228878592,Andrew Yang,AndrewYang,292213,4707,USA,True
1100610366889955328,2019-02-27,@samkotrba Thank you 👍,Thank,0.3612,0.0,0,4,en,2228878592,Andrew Yang,AndrewYang,292213,4707,USA,True
1100606827690119168,2019-02-27,@IrshadManji @marianne2020 @PeteButtigieg @JonHaidt Thanks Irshad 👍,Thanks Irshad,0.2,0.2,0,16,en,2228878592,Andrew Yang,AndrewYang,292213,4707,USA,True
1100606769351573504,2019-02-27,"RT @IrshadManji: Tonight, I met @AndrewYangVFA, candidate for 2020 Dem nomination for POTUS. He’s a doer &amp; not just a dreamer. Let’s get hi…",Tonight candidate nomination POTUS doer just dreamer,0.0,0.0,72,0,en,2228878592,Andrew Yang,AndrewYang,292213,4707,USA,True
1100604258414747648,2019-02-27,@AADC_Chair Thank you Ling!  😀,Thank Ling,0.3612,0.0,0,5,en,2228878592,Andrew Yang,AndrewYang,292213,4707,USA,True
1100603644318281728,2019-02-27,"We are going to rebuild the American middle class in the most direct way possible - by putting $12,000 a year into everyone’s hands.",going rebuild American middle class most direct possible putting year into everyone hands,0.12,0.38,407,2275,en,2228878592,Andrew Yang,AndrewYang,292213,4707,USA,True
1100591588449939459,2019-02-27,"We are halfway there - 32,500 donors and counting!!  Thank you for making it happen!!  We are getting stronger all the time.",halfway there donors counting Thank making happen getting stronger time,0.6249,0.0,57,703,en,2228878592,Andrew Yang,AndrewYang,292213,4707,USA,True
1100586223989678080,2019-02-27,Fantastic being on @wmur with @adamsextonwmur https://t.co/0wuiNLJqKi town hall airs Thursday in New Hampshire at 7 pm,Fantastic being with wuiNLJqKi town hall airs Thursday Hampshire,0.4,0.9,36,161,en,2228878592,Andrew Yang,AndrewYang,292213,4707,USA,True
1100575033800445952,2019-02-27,@marwilliamson Thank you Marianne - excited to be included.  👍🙏,Thank Marianne excited included,0.375,0.75,2,50,en,2228878592,Andrew Yang,AndrewYang,292213,4707,USA,True
1100574921154019329,2019-02-27,"RT @marwilliamson: I am excited to have @AndrewYangVFA join tomorrow night's live Citizen Campaign Call, February 27th at 5:30pm PST. Detai…",excited have join tomorrow night live Citizen Campaign Call February Detai,0.2556818181818182,0.625,68,0,en,2228878592,Andrew Yang,AndrewYang,292213,4707,USA,True
1100568324453232640,2019-02-27,"Big money has ruined our political system. The fix is quite simple: give each citizen $100 ""Democracy Dollars"" per year that can only be donated to political campaigns. This would wash out the influence of big money and give power back to people. https://t.co/ooDR2ThAPs",money ruined political system quite simple give each citizen Democracy Dollars year that only donated political campaigns This would wash influence money give power back people ooDR ThAPs,-0.4767,0.3114285714285715,321,1154,en,2228878592,Andrew Yang,AndrewYang,292213,4707,USA,True
1100551219922255877,2019-02-27,"Thank you all for the incredible support! We have crossed 32,500 donors. We are halfway there! This campaign is bringing together the best people. Let's not let up now. Tag a friend in this post and ask for $1. Let's get on the debate stage. 👍🥊

https://t.co/daodQfDFvt https://t.co/nE9AFJMDkB",Thank incredible support have crossed donors halfway there This campaign bringing together best people friend this post debate stage daodQfDFvt AFJMDkB,0.95,0.6,456,1880,en,2228878592,Andrew Yang,AndrewYang,292213,4707,USA,True
1100526164488192001,2019-02-26,"The Freedom Dividend would enhance the dynamism of our society on a staggering scale - more businesses, arts, creativity, migration, risk-taking and innovation.  Imagine how many people have something inside of them they have wanted to share.  We will unleash our own potential.",Freedom Dividend would enhance dynamism society staggering scale more businesses arts creativity migration risk taking innovation Imagine many people have something inside them they have wanted share will unleash potential,0.3333333333333333,0.6666666666666666,329,1399,en,2228878592,Andrew Yang,AndrewYang,292213,4707,USA,True
1100515456526573568,2019-02-26,"RT @CNBC: Presidential candidate @AndrewYangVFA is giving one New Hampshire mom $1,000 a month to show UBI works. If elected president, he…",Presidential candidate giving Hampshire month show works elected president,0.34,0.0,248,0,en,2228878592,Andrew Yang,AndrewYang,292213,4707,USA,True
1100497884301144064,2019-02-26,@casey___ Thank you Casey 👍😀,Thank Casey,0.3612,0.0,1,4,en,2228878592,Andrew Yang,AndrewYang,292213,4707,USA,True
1100497645653635072,2019-02-26,@geryfesalvo Yes coming soon 👍,coming soon,0.0,0.0,1,13,en,2228878592,Andrew Yang,AndrewYang,292213,4707,USA,True
1100496416009584640,2019-02-26,This campaign has had a mindset of abundance from the beginning.  Thank you for making that abundance real.  👍🙏,This campaign mindset abundance from beginning Thank making that abundance real,0.2,0.30000000000000004,52,740,en,2228878592,Andrew Yang,AndrewYang,292213,4707,USA,True
1100490633930858498,2019-02-26,Turns out New Haven (a)pizza is special.,Turns Haven pizza special,0.35714285714285715,0.5714285714285714,12,176,en,2228878592,Andrew Yang,AndrewYang,292213,4707,USA,True
1100489660499927040,2019-02-26,@Alex_Creator Yes if green card.  Bug your citizen friends!  👍,green card your citizen friends,-0.2,0.3,1,9,en,2228878592,Andrew Yang,AndrewYang,292213,4707,USA,True
1100475082739191808,2019-02-26,I’m a Pete fan and think him making the debate would be great. https://t.co/g2bo6UqffY #HumanityFirst https://t.co/OwjSbZvqlI,Pete think making debate would great UqffY #HumanityFirst OwjSbZvqlI,0.8,0.75,43,368,en,2228878592,Andrew Yang,AndrewYang,292213,4707,USA,True
1100470110882590721,2019-02-26,Our attention is valuable. Companies should not be harassing us with robocalls that serve no useful purpose except to try and fatten their bottom line. I will ban robocalls.   https://t.co/pffVQEAgJl I remember when I used to be glad when my phone rang. Let’s get back there.,attention valuable Companies should harassing with robocalls that serve useful purpose except fatten their bottom line will robocalls pffVQEAgJl remember when used glad when phone rang back there,0.26666666666666666,0.3333333333333333,211,1147,en,2228878592,Andrew Yang,AndrewYang,292213,4707,USA,True
1100460555687612416,2019-02-26,@nicholastmusic Thank you 👍,Thank,0.3612,0.0,0,14,en,2228878592,Andrew Yang,AndrewYang,292213,4707,USA,True
1100458742137663489,2019-02-26,Some people call me a futurist. I'd say I'm a present-ist. It's just that the other politicians are stuck in the past. https://t.co/ECfQ6CNmVk,Some people call futurist present just that other politicians stuck past ECfQ CNmVk,-0.125,0.20833333333333334,180,885,en,2228878592,Andrew Yang,AndrewYang,292213,4707,USA,True
1100438441588899841,2019-02-26,RT @WMUR9: .@AndrewYangVFA joined @AdamSextonWMUR this morning at the @WMUR9 studios for a taping of Conversation with the Candidate. See t…,joined this morning studios taping Conversation with Candidate,0.0,0.0,32,0,en,2228878592,Andrew Yang,AndrewYang,292213,4707,USA,True
1100438380125536256,2019-02-26,Just finished town hall at @WMUR with @AdamSextonWMUR in Manchester - excited to meet with New Hampshire voters.  Will air Thursday night in prime time.  👍 https://t.co/3HYk1W3V7x,Just finished town hall with Manchester excited meet with Hampshire voters Will Thursday night prime time,0.375,0.75,32,255,en,2228878592,Andrew Yang,AndrewYang,292213,4707,USA,True
1100368777353531392,2019-02-26,"31,483.  Almost halfway there with 2-and-a-half months to go!  Our pace is amazing.  😀",Almost halfway there with half months pace amazing,0.21666666666666673,0.5333333333333333,87,893,en,2228878592,Andrew Yang,AndrewYang,292213,4707,USA,True
1100246748872744960,2019-02-26,@maceoVik Nah former Knicks fan.,former Knicks,0.0,0.0,1,13,en,2228878592,Andrew Yang,AndrewYang,292213,4707,USA,True
1100238560211492864,2019-02-26,LeBron missing the playoffs will feel wrong.,LeBron missing playoffs will feel wrong,-0.35,0.47500000000000003,99,707,en,2228878592,Andrew Yang,AndrewYang,292213,4707,USA,True
1100229542772424709,2019-02-26,When we make the debate stage in June certain press outlets will have a little bit of explaining to do 👍,When make debate stage June certain press outlets will have little explaining,0.013392857142857137,0.5357142857142857,142,1384,en,2228878592,Andrew Yang,AndrewYang,292213,4707,USA,True
1100222280091734016,2019-02-26,30% of US malls are closing in the next five years.  Dying malls become sources of blight that depress property values for miles around. We should help communities find new creative uses for these structures wherever possible. https://t.co/3Iu2CTvfHW,malls closing next five years Dying malls become sources blight that depress property values miles around should help communities find creative uses these structures wherever possible CTvfHW,0.10833333333333334,0.5083333333333333,227,1108,en,2228878592,Andrew Yang,AndrewYang,292213,4707,USA,True
1100198461033639937,2019-02-26,No one is coming to fix it.  We are going to have to do it ourselves.,coming going have ourselves,0.0,0.0,353,1913,en,2228878592,Andrew Yang,AndrewYang,292213,4707,USA,True
1100195355428352000,2019-02-26,@_____________h Would immediately fund asteroid detection.,Would immediately fund asteroid detection,0.0,0.0,0,5,en,2228878592,Andrew Yang,AndrewYang,292213,4707,USA,True
1100194163751038977,2019-02-26,If someone else does better that doesn’t mean you do worse.  It generally means the opposite.,someone else does better that doesn mean worse generally means opposite,-0.0325,0.4575,100,580,en,2228878592,Andrew Yang,AndrewYang,292213,4707,USA,True
1100193516427378688,2019-02-26,@susandanziger @michaelpwenger Thanks Susan and Michael 😀👍,Thanks Susan Michael,0.2,0.2,0,7,en,2228878592,Andrew Yang,AndrewYang,292213,4707,USA,True
1100193464422154241,2019-02-26,"RT @susandanziger: Get More Yang for Your Buck — ensure UBI gets national attention by donating $1 to @AndrewYangVFA campaign. 
NB The “Yan…",More Yang Your Buck ensure gets national attention donating campaign,0.5,0.5,49,0,en,2228878592,Andrew Yang,AndrewYang,292213,4707,USA,True
1100191338669268992,2019-02-26,When nearly all of the top authorities are sounding the alarms on massive job automation it is time to wake up. We need to build a different kind of economy as fast as possible. https://t.co/YBK1RXJKWh,When nearly authorities sounding alarms massive automation time wake need build different kind economy fast possible RXJKWh,0.15,0.75,303,817,en,2228878592,Andrew Yang,AndrewYang,292213,4707,USA,True
1100173875474849797,2019-02-25,The progress-meter is now up at https://t.co/OvoGKOhrwi!  Thank you for making it move in the right direction.  👍🥊🇺🇸. What should my icon do when I reach the podium?  🇺🇸,progress meter OvoGKOhrwi Thank making move right direction What should icon when reach podium,0.2857142857142857,0.5357142857142857,73,520,en,2228878592,Andrew Yang,AndrewYang,292213,4707,USA,True
1100171113232064513,2019-02-25,"We have raised over $400,000 in the last two weeks from over 20,000 donors.  We are doing this thing.  The Revolution of Reason is on.  👍🇺🇸",have raised over last weeks from over donors doing this thing Revolution Reason,0.0,0.06666666666666667,417,2899,en,2228878592,Andrew Yang,AndrewYang,292213,4707,USA,True
1100165552155357186,2019-02-25,"RT @RachelSB: Presidential march in Iowa: @ewarren, @marwilliamson. @PeteButtigieg, @AndrewYangVFA (and more, I'm predicting) will stop by…",Presidential march Iowa more predicting will stop,0.5,0.5,19,0,en,2228878592,Andrew Yang,AndrewYang,292213,4707,USA,True
1100163463576514560,2019-02-25,@nogueira21 @brenthatley @SkylerFetish Would love that,Would love that,0.5,0.6,0,4,en,2228878592,Andrew Yang,AndrewYang,292213,4707,USA,True
1100163354566582274,2019-02-25,@DanSpenser Thank you Daniel 👍,Thank Daniel,0.3612,0.0,0,3,en,2228878592,Andrew Yang,AndrewYang,292213,4707,USA,True
