Tweet ID,Date Created,Tweet,Clean_tweet,Polarity,Subjectivity,Retweets,Favorites,Language,User ID,User Name,User Twitter Handle,Follower Count,Friend Count,Location,Verified
1136875306214612993,2019-06-07,If a fan shoves an NBA player during a game he probably shouldn’t be allowed to attend any more NBA games.,shoves player during game probably shouldn allowed attend more games,0.04999999999999999,0.45,59,903,en,2228878592,Andrew Yang,AndrewYang,292213,4707,USA,True
1136826749625311232,2019-06-07,Old friends and new in Seattle!  One fun thing about being on the road.  😀👍 https://t.co/DseYpS8aAk,friends Seattle thing about being road DseYpS,0.4767,0.0,25,495,en,2228878592,Andrew Yang,AndrewYang,292213,4707,USA,True
1136817054827405312,2019-06-07,We draw supporters from every walk of life because our message is about solutions that will help us all. https://t.co/5WkGkfl2OY,draw supporters from every walk life because message about solutions that will help WkGkfl,0.743,0.0,90,493,en,2228878592,Andrew Yang,AndrewYang,292213,4707,USA,True
1136785004380319744,2019-06-07,And we will do an Andrew Yang dance in perfect unison.,will Andrew Yang dance perfect unison,1.0,1.0,76,1171,en,2228878592,Andrew Yang,AndrewYang,292213,4707,USA,True
1136779104043261954,2019-06-06,@peterboghossian Thanks Peter - means a lot.  We need more philosophy in the White House.,Thanks Peter means need more philosophy White House,0.2333333333333333,0.2333333333333333,32,400,en,2228878592,Andrew Yang,AndrewYang,292213,4707,USA,True
1136778932462600192,2019-06-06,Thank you Peter - this means a lot.  👍 https://t.co/kRKE34YELq,Thank Peter this means kRKE YELq,0.3612,0.0,37,473,en,2228878592,Andrew Yang,AndrewYang,292213,4707,USA,True
1136769697255288832,2019-06-06,You know what I find really odd - the transitive property of points of view.  That is if I talk to someone I must believe everything they believe. That seems ridiculous to me. Of course people will believe different things.,know what find really transitive property points view That talk someone must believe everything they believe That seems ridiculous course people will believe different things,-0.04444444444444443,0.6,274,1619,en,2228878592,Andrew Yang,AndrewYang,292213,4707,USA,True
1136760972117307392,2019-06-06,The illusions are failing. We are in an era of unpleasant truths. The question is what we do with them.,illusions failing unpleasant truths question what with them,-0.6499999999999999,0.95,306,1431,en,2228878592,Andrew Yang,AndrewYang,292213,4707,USA,True
1136758116912025602,2019-06-06,@RubinReport Looking forward to this 👍,Looking forward this,0.0,0.0,20,436,en,2228878592,Andrew Yang,AndrewYang,292213,4707,USA,True
1136758076449538048,2019-06-06,RT @RubinReport: We’re live with Democratic presidential candidate @AndrewYang  tomorrow! Subscribe and click the bell so you’re notified.…,live with Democratic presidential candidate tomorrow Subscribe click bell notified,0.13636363636363635,0.5,224,0,en,2228878592,Andrew Yang,AndrewYang,292213,4707,USA,True
1136756885896421376,2019-06-06,And for those who are wondering the answer is Randy Savage.,those wondering answer Randy Savage,-0.4588,0.0,108,1718,en,2228878592,Andrew Yang,AndrewYang,292213,4707,USA,True
1136756421700202496,2019-06-06,"Running for President is one part startup, one part playwright, one part media company, and one part pro wrestling.",Running President part startup part playwright part media company part wrestling,0.0,0.0,248,2418,en,2228878592,Andrew Yang,AndrewYang,292213,4707,USA,True
1136713021902925824,2019-06-06,Met another Andrew Yang last night.  One day all of us will get together.,another Andrew Yang last night will together,0.0,0.06666666666666667,172,3108,en,2228878592,Andrew Yang,AndrewYang,292213,4707,USA,True
1136701280875757568,2019-06-06,The best balance would be term limits that are quite long - say 18 years - that would be long enough for expertise and coalitions to be built up without letting legislators become totally careerist and self-dealing.,best balance would term limits that quite long years that would long enough expertise coalitions built without letting legislators become totally careerist self dealing,0.18,0.47000000000000003,91,898,en,2228878592,Andrew Yang,AndrewYang,292213,4707,USA,True
1136700653630214144,2019-06-06,The drawback to term limits is that they would entrench the non-legislative bureaucracy and may make it harder for legislators to organize as everyone keeps showing up new with a learning curve and a need to form relationships and coalitions.,drawback term limits that they would entrench legislative bureaucracy make harder legislators organize everyone keeps showing with learning curve need form relationships coalitions,-0.1,0.0,61,640,en,2228878592,Andrew Yang,AndrewYang,292213,4707,USA,True
1136700183662735361,2019-06-06,"Had an amazing rally in Minneapolis. The takeaway: you can feel bad about what's going on in this country, but the moment you start to do something about it, you feel a lot better. 😀👍🇺🇸 https://t.co/xY2u87eLFd",amazing rally Minneapolis takeaway feel about what going this country moment start something about feel better eLFd,0.55,0.7,125,661,en,2228878592,Andrew Yang,AndrewYang,292213,4707,USA,True
1136694514695802880,2019-06-06,Term limits in DC are a good idea - they would lead legislators to try and get something done and then go home. They would also make room for new leaders. We all know some folks have been in DC for a very long time.,Term limits good idea they would lead legislators something done then home They would also make room leaders know some folks have been very long time,0.3175,0.56,266,1858,en,2228878592,Andrew Yang,AndrewYang,292213,4707,USA,True
1136675883685765121,2019-06-06,"College is too expensive, forcing many to take out student loans that will saddle them with debt throughout their lives. I would forgive much of this debt and work with schools to reduce tuition. We can do much better for our young people. https://t.co/D8I3l5P6vT",College expensive forcing many take student loans that will saddle them with debt throughout their lives would forgive much this debt work with schools reduce tuition much better young people,0.15999999999999998,0.45999999999999996,235,1066,en,2228878592,Andrew Yang,AndrewYang,292213,4707,USA,True
1136666983846490117,2019-06-06,@CillizzaCNN Thanks Chris - the #YangGang is just getting started.  😀👍,Thanks Chris #YangGang just getting started,0.2,0.2,14,161,en,2228878592,Andrew Yang,AndrewYang,292213,4707,USA,True
1136666860898807809,2019-06-06,RT @CillizzaCNN: I made a video about the Internet phenomenon that is Andrew Yang https://t.co/oT9kyKvztt,made video about Internet phenomenon that Andrew Yang kyKvztt,0.0,0.0,152,0,en,2228878592,Andrew Yang,AndrewYang,292213,4707,USA,True
1136659327442276355,2019-06-06,Someone thanked me for running for office last night. I told them they should thank my wife.,Someone thanked running office last night told them they should thank wife,0.6597,0.06666666666666667,164,2560,en,2228878592,Andrew Yang,AndrewYang,292213,4707,USA,True
1136653602787811328,2019-06-06,Many college students worry about being able to afford food while they are in school https://t.co/ct9fwNNB2h skyrocketing costs take a very human toll,Many college students worry about being able afford food while they school fwNNB skyrocketing costs take very human toll,0.3333333333333333,0.4183333333333333,137,561,en,2228878592,Andrew Yang,AndrewYang,292213,4707,USA,True
1136653480360370176,2019-06-06,"We were called a ""longer-than-longshot.” Now, we have a chance to contend. We owe a great deal of thanks to our supporters, who advocated for our message when no one else would. Thank you #YangGang! https://t.co/Z465sKRh2K",were called longer than longshot have chance contend great deal thanks supporters advocated message when else would Thank #YangGang sKRh,0.5,0.475,132,884,en,2228878592,Andrew Yang,AndrewYang,292213,4707,USA,True
1136501685302415360,2019-06-06,Spoke to a tech CEO last week who told me “AI is going to replace a lot of basic coding jobs. We don’t talk about that much but it’s happening.”,Spoke tech last week told going replace basic coding jobs talk about that much happening,0.06666666666666667,0.13055555555555556,586,2912,en,2228878592,Andrew Yang,AndrewYang,292213,4707,USA,True
1136422884375535617,2019-06-06,"RT @anybuyershaveit: First day of second grade vs first day working for #Yang2020. Since I was a little girl, I’ve been passionate about 2…",First second grade first working #Yang Since little girl been passionate about,0.052500000000000005,0.4033333333333333,102,0,en,2228878592,Andrew Yang,AndrewYang,292213,4707,USA,True
1136422748715081728,2019-06-06,Congrats @SatoshiLite on being such a pioneer - let’s build the future.  👍 https://t.co/WEQXiizdYs,Congrats being such pioneer build future WEQXiizdYs,0.5267,0.3125,563,3999,en,2228878592,Andrew Yang,AndrewYang,292213,4707,USA,True
1136392127498211328,2019-06-05,I fly coach. It makes for some interesting conversations sometimes.  😀,coach makes some interesting conversations sometimes,0.5,0.5,145,2666,en,2228878592,Andrew Yang,AndrewYang,292213,4707,USA,True
1136390001409908736,2019-06-05,"As the parent of a child on the autism spectrum, this issue touches me personally. Autism affects 1 in 59, but current resources don't meet the needs of these neurologically atypical children. We must end the stigma and better serve these children and families. https://t.co/8jJQgMkcjw",parent child autism spectrum this issue touches personally Autism affects current resources meet needs these neurologically atypical children must stigma better serve these children families jJQgMkcjw,0.125,0.35,235,1127,en,2228878592,Andrew Yang,AndrewYang,292213,4707,USA,True
1136307819467161600,2019-06-05,After a West Coast swing including @billmaher I’m heading to Iowa this weekend for the Iowa Democratic Hall of Fame dinner honoring Fred and Charlotte Hubbell with 8 other presidential candidates https://t.co/2LpPZXYz6x looking forward to it 👍🇺🇸,After West Coast swing including heading Iowa this weekend Iowa Democratic Hall Fame dinner honoring Fred Charlotte Hubbell with other presidential candidates LpPZXYz looking forward,-0.125,0.375,64,510,en,2228878592,Andrew Yang,AndrewYang,292213,4707,USA,True
1136303856076447745,2019-06-05,RT @morgan_forde_: What is #UBI and why are @AndrewYang and @MichaelDTubbs making it the cornerstone of their #2020 policies? My deep dive…,What #UBI making cornerstone their policies deep dive,0.0,0.4,73,0,en,2228878592,Andrew Yang,AndrewYang,292213,4707,USA,True
1136289379008286720,2019-06-05,Yes I do watch Black Mirror.,watch Black Mirror,-0.16666666666666666,0.43333333333333335,377,4767,en,2228878592,Andrew Yang,AndrewYang,292213,4707,USA,True
1136287095817981954,2019-06-05,"Running for president has highlighted to me just how much moneyed interests have captured our democracy. We need to implement new policies in order to retake our democracy for our people. Sign the petition and join me in getting big money out of politics!
https://t.co/JiBw8YAzZA https://t.co/FlgjseURo2",Running president highlighted just much moneyed interests have captured democracy need implement policies order retake democracy people Sign petition join getting money politics JiBw YAzZA FlgjseURo,0.2,0.2,145,638,en,2228878592,Andrew Yang,AndrewYang,292213,4707,USA,True
1136270961165160449,2019-06-05,"It's unfathomable that in the richest, most developed nation in the world, many citizens are unable to afford vital medication. It's time to get pharmaceutical companies in check. https://t.co/jXOBw1B7Yi",unfathomable that richest most developed nation world many citizens unable afford vital medication time pharmaceutical companies check jXOBw,0.14,0.44000000000000006,182,844,en,2228878592,Andrew Yang,AndrewYang,292213,4707,USA,True
1136250484040380417,2019-06-05,America needs a comprehensive 5G rollout strategy. It’s vital to our present and future competitiveness.,America needs comprehensive rollout strategy vital present future competitiveness,0.03333333333333333,0.17500000000000002,188,1752,en,2228878592,Andrew Yang,AndrewYang,292213,4707,USA,True
1136097474190426112,2019-06-05,Most Americans don’t think they’ll have adequate retirement savings and a quarter have nothing saved https://t.co/SEPPhZzJoa the Freedom Dividend would help,Most Americans think they have adequate retirement savings quarter have nothing saved SEPPhZzJoa Freedom Dividend would help,0.41666666666666663,0.41666666666666663,127,645,en,2228878592,Andrew Yang,AndrewYang,292213,4707,USA,True
1136090195936387072,2019-06-05,I remember having ~30k friends on Twitter like it was a few months ago - probably because it was just a few months ago.  😀,remember having friends Twitter like months probably because just months,0.6808,0.0,126,2284,en,2228878592,Andrew Yang,AndrewYang,292213,4707,USA,True
1136089830285295616,2019-06-05,"RT @CRDAnalytics: “They’ll also need a guaranteed minimum basic income – a subsistence-level cushion against earnings downturns.” 

Robert…",They also need guaranteed minimum basic income subsistence level cushion against earnings downturns Robert,0.0,0.125,98,0,en,2228878592,Andrew Yang,AndrewYang,292213,4707,USA,True
1136080168802557952,2019-06-05,You do have this Leslie!  👍🇺🇸🥊 https://t.co/jp9QUAVztH,have this Leslie QUAVztH,0.0,0.0,35,408,en,2228878592,Andrew Yang,AndrewYang,292213,4707,USA,True
1136063912464527365,2019-06-05,Thrilled the House has passed the American Dream and Promise Act — now for the Senate to make it law.  👍🇺🇸 #DreamAndPromiseNow,Thrilled House passed American Dream Promise Senate make #DreamAndPromiseNow,0.3,0.35,71,603,en,2228878592,Andrew Yang,AndrewYang,292213,4707,USA,True
1136052781951983621,2019-06-04,Hey #YangGang ! We have exciting plans in the works and need your help to make them happen. Can you donate $20 today and help us reach our Q2 fundraising goal of 3.5 million? https://t.co/daodQfDFvt https://t.co/KVdMplEzfn,#YangGang have exciting plans works need your help make them happen donate today help reach fundraising goal million daodQfDFvt KVdMplEzfn,0.3,0.8,707,2464,en,2228878592,Andrew Yang,AndrewYang,292213,4707,USA,True
1136021515416285185,2019-06-04,People won’t agree with me on everything - but I think they will respect my approach and know that I’m approaching problems with an eye toward what the data says as well as the experience on the ground. I don’t care whose idea it is if it solves the problem.,People agree with everything think they will respect approach know that approaching problems with toward what data says well experience ground care whose idea solves problem,0.765,0.0,756,5037,en,2228878592,Andrew Yang,AndrewYang,292213,4707,USA,True
1136017029822078981,2019-06-04,"The tariffs on imports from Mexico will hit American consumers, cost tens of thousands of American jobs and are a bizarre way to stem the flow of migrants - if their economy takes a hit more people will want to move for new opportunities. It’s a big move in the wrong direction.",tariffs imports from Mexico will American consumers cost tens thousands American jobs bizarre stem flow migrants their economy takes more people will want move opportunities move wrong direction,0.08,0.4,230,1094,en,2228878592,Andrew Yang,AndrewYang,292213,4707,USA,True
1136016532939649024,2019-06-04,"Automation and artificial intelligence pose an unprecedented challenge to our current version of capitalism. We must evolve towards a new form of human-centered capitalism that focuses on our success, health and well-being. https://t.co/B9W8VKej9A",Automation artificial intelligence pose unprecedented challenge current version capitalism must evolve towards form human centered capitalism that focuses success health well being VKej,0.06,0.48,189,734,en,2228878592,Andrew Yang,AndrewYang,292213,4707,USA,True
1136007481677832192,2019-06-04,Depression is a crisis among millennials in particular and many can’t afford treatment https://t.co/8D4JWHMl7w this is something I can’t wait to change as President.  I will be the Mental Health President.  👍🇺🇸,Depression crisis among millennials particular many afford treatment JWHMl this something wait change President will Mental Health President,0.18888888888888888,0.3444444444444444,379,1522,en,2228878592,Andrew Yang,AndrewYang,292213,4707,USA,True
1136004913073405952,2019-06-04,"RT @MurrayRothbar11: Daily reminder:

Donald Trump has, cleverly, been giving the most free publicity to the candidates he most wants to fa…",Daily reminder Donald Trump cleverly been giving most free publicity candidates most wants,0.29444444444444445,0.45555555555555566,491,0,en,2228878592,Andrew Yang,AndrewYang,292213,4707,USA,True
1136004260209012737,2019-06-04,When I started this campaign I figured I’d vote for someone like me.  I couldn’t be the only one.  😀,When started this campaign figured vote someone like couldn only,0.3612,1.0,139,1879,en,2228878592,Andrew Yang,AndrewYang,292213,4707,USA,True
1135985845377409026,2019-06-04,Police officers do a dangerous job every day and deserve our support. The public also deserves to hold public servants accountable for their actions. Having a camera will help both the public and the police officer resolve complaints. The benefits are clear and well researched. https://t.co/Gk2ZtYT0GH,Police officers dangerous every deserve support public also deserves hold public servants accountable their actions Having camera will help both public police officer resolve complaints benefits clear well researched ZtYT,-0.09999999999999999,0.2966666666666667,140,804,en,2228878592,Andrew Yang,AndrewYang,292213,4707,USA,True
1135982018125279232,2019-06-04,.@NBCNews with a profile on me in New Hampshire that’s now up https://t.co/0Xb6xdyXln thanks @SimoneBoyce 👍🇺🇸,with profile Hampshire that xdyXln thanks,0.2,0.2,60,341,en,2228878592,Andrew Yang,AndrewYang,292213,4707,USA,True
1135978722820001792,2019-06-04,The Trump tax cuts went mainly to the rich https://t.co/LaWTH4bQcj,Trump cuts went mainly rich LaWTH bQcj,0.375,0.75,347,1510,en,2228878592,Andrew Yang,AndrewYang,292213,4707,USA,True
1135968998598873091,2019-06-04,Looking forward to this 👍😀 https://t.co/JirY2nZs8D,Looking forward this JirY,0.0,0.0,229,1902,en,2228878592,Andrew Yang,AndrewYang,292213,4707,USA,True
1135947330753089536,2019-06-04,Happy Pride Month! #HumanityFirst means celebrating how we all live and love. https://t.co/QiZczk6gpO,Happy Pride Month #HumanityFirst means celebrating live love QiZczk,0.4787878787878788,0.7000000000000001,75,554,en,2228878592,Andrew Yang,AndrewYang,292213,4707,USA,True
1135923253904588800,2019-06-04,RT @AM2DM: 2020 Democratic candidate @AndrewYang explains why he wants to give everyone $1000 a month https://t.co/CkeYyshaKZ,Democratic candidate explains wants give everyone month CkeYyshaKZ,0.2,0.1,159,0,en,2228878592,Andrew Yang,AndrewYang,292213,4707,USA,True
1135904743891656705,2019-06-04,Money doesn’t solve every problem - but it sure helps with a lot of them.,Money doesn solve every problem sure helps with them,0.5,0.8888888888888888,569,3338,en,2228878592,Andrew Yang,AndrewYang,292213,4707,USA,True
1135887240347947008,2019-06-04,@Inc Thanks @TalibVisram 👍,Thanks,0.2,0.2,4,50,en,2228878592,Andrew Yang,AndrewYang,292213,4707,USA,True
1135886899296571393,2019-06-04,"RT @Inc: This Founder Wants to Rebrand America and Give Every Citizen $1,000 a Month. Here's Why He Wants Your Vote https://t.co/MFdVq5Cax7",This Founder Wants Rebrand America Give Every Citizen Month Here Wants Your Vote MFdVq,0.2,0.1,322,0,en,2228878592,Andrew Yang,AndrewYang,292213,4707,USA,True
1135742912787034112,2019-06-04,Someone should definitely run against Trump in the Republican primary aside from William Weld. @mcuban? Higher upside than most think.,Someone should definitely against Trump Republican primary aside from William Weld Higher upside than most think,0.2875,0.5,115,1351,en,2228878592,Andrew Yang,AndrewYang,292213,4707,USA,True
1135731447619379200,2019-06-04,If I thought things were going to be all right I definitely would not have run for President.,thought things were going right definitely would have President,0.14285714285714285,0.5178571428571428,338,3125,en,2228878592,Andrew Yang,AndrewYang,292213,4707,USA,True
1135670920402612224,2019-06-03,I wear makeup so often now I often forget that it’s on.,wear makeup often often forget that,-0.2263,0.0,141,1847,en,2228878592,Andrew Yang,AndrewYang,292213,4707,USA,True
1135663650763657221,2019-06-03,"RT @BloombergTV: Presidential candidate Andrew Yang weighs in on the universal basic income debate with his ""Freedom Dividend"" plan https:/…",Presidential candidate Andrew Yang weighs universal basic income debate with Freedom Dividend plan,0.6369,0.0625,291,0,en,2228878592,Andrew Yang,AndrewYang,292213,4707,USA,True
1135643182937628677,2019-06-03,The bottom 80% of Americans own 8% of stock market wealth and the bottom half own essentially zero.  Anyone who pays attention to stock prices as a barometer of how Americans are doing is missing how most people live.,bottom Americans stock market wealth bottom half essentially zero Anyone pays attention stock prices barometer Americans doing missing most people live,0.05393939393939393,0.30333333333333334,1920,7882,en,2228878592,Andrew Yang,AndrewYang,292213,4707,USA,True
1135635056725233666,2019-06-03,If you think our institutions are going to rescue us you have not been paying close attention.,think institutions going rescue have been paying close attention,0.5106,0.0,674,3685,en,2228878592,Andrew Yang,AndrewYang,292213,4707,USA,True
1135629503609409541,2019-06-03,Thank you @jack for the support - look forward to fighting for the future alongside you.  👍🇺🇸🥊,Thank support look forward fighting future alongside,0.4019,0.125,95,1132,en,2228878592,Andrew Yang,AndrewYang,292213,4707,USA,True
1135580433838686209,2019-06-03,Heading on @RealTimers on @HBO with @billmaher this Friday - looking forward to it.  👍,Heading with this Friday looking forward,0.0,0.0,202,1753,en,2228878592,Andrew Yang,AndrewYang,292213,4707,USA,True
1135578919195877376,2019-06-03,"Martin Luther King Jr. believed that a just society required the elimination of poverty, and that the elimination of poverty required Universal Basic Income. https://t.co/Jeg7w11SXq",Martin Luther King believed that just society required elimination poverty that elimination poverty required Universal Basic Income,-0.765,0.0625,318,1306,en,2228878592,Andrew Yang,AndrewYang,292213,4707,USA,True
1135561912882778112,2019-06-03,People are hungry for innovation and good ideas - good leaders will take the best ideas from any and every source. https://t.co/RmVjmiKyQq,People hungry innovation good ideas good leaders will take best ideas from every source RmVjmiKyQq,0.7999999999999999,0.5000000000000001,156,707,en,2228878592,Andrew Yang,AndrewYang,292213,4707,USA,True
1135561643675529220,2019-06-03,@sapinker Thanks Steven,Thanks Steven,0.2,0.2,11,385,en,2228878592,Andrew Yang,AndrewYang,292213,4707,USA,True
1135532870221672450,2019-06-03,Trucking generates $700 billion in revenue and employs 7.4 million Americans - more than 1 in 20 US jobs https://t.co/Ddfwm4Rm9L,Trucking generates billion revenue employs million Americans more than jobs Ddfwm,0.5,0.5,176,940,en,2228878592,Andrew Yang,AndrewYang,292213,4707,USA,True
1135531662685724673,2019-06-03,We are years behind the curve in terms of technology’s impact on our economy and society - we need to speed up as fast as possible.  That’s why I’m running for President. https://t.co/5r6dUJY9u7,years behind curve terms technology impact economy society need speed fast possible That running President dUJY,-0.06666666666666667,0.7666666666666666,314,1479,en,2228878592,Andrew Yang,AndrewYang,292213,4707,USA,True
1135397490151350274,2019-06-03,This shirt is back in stock by popular demand 👍 https://t.co/5k77UD5du6,This shirt back stock popular demand,0.3,0.45,40,423,en,2228878592,Andrew Yang,AndrewYang,292213,4707,USA,True
1135380328149860352,2019-06-03,Yikes - Toronto kind of needed that game.,Yikes Toronto kind needed that game,0.09999999999999998,0.65,40,701,en,2228878592,Andrew Yang,AndrewYang,292213,4707,USA,True
1135345989810819074,2019-06-03,I’m actually kidding - I think there’s tons of middle ground. 😀👍🇺🇸,actually kidding think there tons middle ground,0.1027,0.05,67,1013,en,2228878592,Andrew Yang,AndrewYang,292213,4707,USA,True
1135345756553056256,2019-06-03,Will we head toward the solutions of the 20th century or the 21st?  #NoMiddleGround,Will head toward solutions century #NoMiddleGround,0.1779,0.0,104,970,en,2228878592,Andrew Yang,AndrewYang,292213,4707,USA,True
1135344735332253697,2019-06-03,"We’ve launched a fun fundraising competition between our Reddit and Facebook Basecamp group for the month of June. Winner gets an AMA with me 👍🏽😀🇺🇸 see who is winning or join in below:

https://t.co/B9DirzB0kQ
https://t.co/fkqCyx9POh",launched fundraising competition between Reddit Facebook Basecamp group month June Winner gets with winning join below DirzB fkqCyx,0.5,0.75,88,486,en,2228878592,Andrew Yang,AndrewYang,292213,4707,USA,True
1135276965710172160,2019-06-02,My convo with @joerogan passed 3 million views on YouTube https://t.co/c0zzrCCgJr,convo with passed million views YouTube zzrCCgJr,0.0,0.0,581,5063,en,2228878592,Andrew Yang,AndrewYang,292213,4707,USA,True
