Tweet ID,Date Created,Tweet,Clean_tweet,Polarity,Subjectivity,Retweets,Favorites,Language,User ID,User Name,User Twitter Handle,Follower Count,Friend Count,Location,Verified
1108843137135448066,2019-03-21,Getting in some local New Hampshire recreation 👍 https://t.co/aiG9Rs5u75,Getting some local Hampshire recreation,0.0,0.0,104,1709,en,2228878592,Andrew Yang,AndrewYang,292213,4707,USA,True
1108838935013281794,2019-03-21,RT @pewresearch: Most Americans predict that automation in the workplace will increase inequality between the rich and the poor and will no…,Most Americans predict that automation workplace will increase inequality between rich poor will,0.15833333333333333,0.6166666666666667,214,0,en,2228878592,Andrew Yang,AndrewYang,292213,4707,USA,True
1108838787172438018,2019-03-21,RT @douglaswburns: This may be most innovative presidential campaign idea ever: Democratic candidate @AndrewYang may create a 3D  lifelike…,This most innovative presidential campaign idea ever Democratic candidate create lifelike,0.43333333333333335,0.7000000000000001,313,0,en,2228878592,Andrew Yang,AndrewYang,292213,4707,USA,True
1108811552063406080,2019-03-21,"Meeting voters in North Conway, New Hampshire with the @ConwayDailySun https://t.co/lVpHJbbzNf",Meeting voters North Conway Hampshire with lVpHJbbzNf,0.0,0.0,57,546,en,2228878592,Andrew Yang,AndrewYang,292213,4707,USA,True
1108783609689853958,2019-03-21,"RT @CNBC: Meet Andrew Yang, the 44-year-old running for president who wants to give $1,000 free cash per month via @CNBCMakeIt https://t.co…",Meet Andrew Yang year running president wants give free cash month MakeIt,0.30000000000000004,0.45,534,0,en,2228878592,Andrew Yang,AndrewYang,292213,4707,USA,True
1108783430626668544,2019-03-21,"RT @CNBCMakeIt: Meet Andrew Yang, the 44-year-old running for president who wants to give $1,000 free cash per month https://t.co/yr8jlXsde4",Meet Andrew Yang year running president wants give free cash month jlXsde,0.30000000000000004,0.45,261,0,en,2228878592,Andrew Yang,AndrewYang,292213,4707,USA,True
1108783350276333569,2019-03-21,"RT @CatClifford: ""One of my supporters said something to me — that the opposite of @realDonaldTrump is an Asian man who likes math,"" @Andre…",supporters said something that opposite Asian likes math,0.6908,0.0,105,0,en,2228878592,Andrew Yang,AndrewYang,292213,4707,USA,True
1108777770308513792,2019-03-21,100% brother.,brother,0.0,0.0,653,3896,en,2228878592,Andrew Yang,AndrewYang,292213,4707,USA,True
1108767369890091008,2019-03-21,RT @AndrewYang: We report fundraising totals at the end of March. The better we do in both number of donors and dollars the more the press…,report fundraising totals March better both number donors dollars more press,0.5,0.5,270,0,en,2228878592,Andrew Yang,AndrewYang,292213,4707,USA,True
1108726494610759681,2019-03-21,Apparently recidivism rates for certain violent crimes among men are very low partially because people age out and testosterone levels drop. Many did something as a teenager and then got released years later.,Apparently recidivism rates certain violent crimes among very partially because people testosterone levels drop Many something teenager then released years later,-0.027619047619047637,0.4685714285714286,101,1476,en,2228878592,Andrew Yang,AndrewYang,292213,4707,USA,True
1108725403609370625,2019-03-21,Just spent time with an ex-convict who helps reacclimate other formerly incarcerated men into society. He suggests tax breaks for hiring ex-cons. I’m for that but unfortunately don’t think it would do enough. Everyone deserves a second chance though - this guy is now thriving.,Just spent time with convict helps reacclimate other formerly incarcerated into society suggests breaks hiring cons that unfortunately think would enough Everyone deserves second chance though this thriving,-0.12083333333333333,0.32916666666666666,239,2763,en,2228878592,Andrew Yang,AndrewYang,292213,4707,USA,True
1108721699787296774,2019-03-21,"Humanity is more important than money.  The unit of an economy is each person, not each dollar.  Markets exist to serve our common goals and values.  We can make this happen. https://t.co/7xOUk29qqS",Humanity more important than money unit economy each person each dollar Markets exist serve common goals values make this happen xOUk,0.20000000000000004,0.6666666666666666,434,1918,en,2228878592,Andrew Yang,AndrewYang,292213,4707,USA,True
1108675623675932675,2019-03-21,Looks like I’ll be on @cspan later today - might be my first time.,Looks like later today might first time,0.125,0.16666666666666666,145,1886,en,2228878592,Andrew Yang,AndrewYang,292213,4707,USA,True
1108578745185718272,2019-03-21,We will peak at the right time.  Getting stronger every day.  👍🇺🇸,will peak right time Getting stronger every,0.2857142857142857,0.5357142857142857,264,3482,en,2228878592,Andrew Yang,AndrewYang,292213,4707,USA,True
1108561089581719552,2019-03-21,I feel like being able to have a pet is a worthy benchmark of quality of life. Not a fish. A real pet. https://t.co/6t0KFNKoWU,feel like being able have worthy benchmark quality life fish real KFNKoWU,0.3444444444444444,0.6416666666666667,200,2827,en,2228878592,Andrew Yang,AndrewYang,292213,4707,USA,True
1108531304289783808,2019-03-21,Awesome event in Plymouth NH with @marchandsteve with local Dems https://t.co/L3ofFsvjt1,Awesome event Plymouth with with local Dems ofFsvjt,0.5,0.5,62,628,en,2228878592,Andrew Yang,AndrewYang,292213,4707,USA,True
1108509194888663041,2019-03-20,Automation is ramping up and will impact every corner of our economy. https://t.co/aW9tmdWQjV,Automation ramping will impact every corner economy tmdWQjV,0.0,0.0,1110,2941,en,2228878592,Andrew Yang,AndrewYang,292213,4707,USA,True
1108479430958215173,2019-03-20,"As someone who was very good at standardized tests growing up I think they are a terrible measurement of anything other than whether you are good at the test. Certainly have nothing to do with human worth, character or virtue.",someone very good standardized tests growing think they terrible measurement anything other than whether good test Certainly have nothing with human worth character virtue,0.1427551020408163,0.5037755102040817,1958,12312,en,2228878592,Andrew Yang,AndrewYang,292213,4707,USA,True
1108468773558906882,2019-03-20,Depression among young people has skyrocketed https://t.co/V8iqWCTuvG we should take this very seriously and try to treat and strengthen from every angle @jean_twenge,Depression among young people skyrocketed iqWCTuvG should take this very seriously treat strengthen from every angle,-0.16666666666666669,0.6333333333333333,335,1538,en,2228878592,Andrew Yang,AndrewYang,292213,4707,USA,True
1108458129333936134,2019-03-20,These Midwestern floods are a genuine disaster https://t.co/oWDZa92CGU was just in Iowa last week and feel for those affected.  🙏,These Midwestern floods genuine disaster oWDZa just Iowa last week feel those affected,0.2,0.2833333333333333,90,685,en,2228878592,Andrew Yang,AndrewYang,292213,4707,USA,True
1108455738970701830,2019-03-20,Also in northern New Hampshire Thursday and Friday https://t.co/a5aaaDiqel  come on out would love to meet you 👍🇺🇸,Also northern Hampshire Thursday Friday aaaDiqel come would love meet,0.5,0.6,43,337,en,2228878592,Andrew Yang,AndrewYang,292213,4707,USA,True
1108454078542217221,2019-03-20,"RT @AndrewYang: Heading to Plymouth, New Hampshire today with @marchandsteve!  https://t.co/xIrfD0nDZd come on out and see you soon 👍🇺🇸",Heading Plymouth Hampshire today with xIrfD nDZd come soon,0.0,0.0,62,0,en,2228878592,Andrew Yang,AndrewYang,292213,4707,USA,True
1108448106872520705,2019-03-20,Here’s @jimmyfallon on the Freedom Dividend last night.  #YangGang2020 👍🇺🇸 https://t.co/02bbJe0AC0,Here Freedom Dividend last night #YangGang bbJe,0.6369,0.06666666666666667,380,2111,en,2228878592,Andrew Yang,AndrewYang,292213,4707,USA,True
1108439456670015488,2019-03-20,@kevinroose Thanks Kevin 👍🇺🇸,Thanks Kevin,0.2,0.2,3,71,en,2228878592,Andrew Yang,AndrewYang,292213,4707,USA,True
1108412288392941568,2019-03-20,I find that not talking to people is a terrible way to convince them of anything.,find that talking people terrible convince them anything,-1.0,1.0,806,5939,en,2228878592,Andrew Yang,AndrewYang,292213,4707,USA,True
1108411044110757892,2019-03-20,.@benshapiro would be happy to have a convo - my team will follow up.,would happy have convo team will follow,0.8,1.0,1211,14259,en,2228878592,Andrew Yang,AndrewYang,292213,4707,USA,True
1108392115963342850,2019-03-20,The Yang Gang is growing - this is what we stand for.  Rule #1:  Always talk about Yang Gang.  #HumanityFirst https://t.co/LzZtdPOTI2,Yang Gang growing this what stand Rule Always talk about Yang Gang #HumanityFirst LzZtdPOTI,0.1779,0.0,651,2568,en,2228878592,Andrew Yang,AndrewYang,292213,4707,USA,True
1108389068386250753,2019-03-20,Heard I was mentioned on @jimmyfallon last night.  Sign of things to come.  😀👍,Heard mentioned last night Sign things come,0.0,0.06666666666666667,104,2034,en,2228878592,Andrew Yang,AndrewYang,292213,4707,USA,True
1108384316793516032,2019-03-20,Distinguishing between real and perceived threats is key https://t.co/yzxjdMRBV9 traffic in substance and not perception,Distinguishing between real perceived threats yzxjdMRBV traffic substance perception,0.2,0.30000000000000004,75,568,en,2228878592,Andrew Yang,AndrewYang,292213,4707,USA,True
1108382949672660994,2019-03-20,@davidktian Yes you can David.  😀👍,David,0.0,0.0,2,129,en,2228878592,Andrew Yang,AndrewYang,292213,4707,USA,True
1108380460235792384,2019-03-20,The 4th Industrial Revolution and the rise of AI is no time for business as usual.,Industrial Revolution rise time business usual,-0.25,0.25,321,2116,en,2228878592,Andrew Yang,AndrewYang,292213,4707,USA,True
1108372599657152513,2019-03-20,The Rise of the Yang Gang sounds like a movie I’d see.,Rise Yang Gang sounds like movie,0.3612,0.0,798,6446,en,2228878592,Andrew Yang,AndrewYang,292213,4707,USA,True
1108368743162408960,2019-03-20,We report fundraising totals at the end of March. The better we do in both number of donors and dollars the more the press will be forced to acknowledge us. Let’s make sure that everyone knows that we can win. Donate and tell friends to donate today. 👍🇺🇸🥊https://t.co/Gp4E3EFZO0,report fundraising totals March better both number donors dollars more press will forced acknowledge make sure that everyone knows that Donate tell friends donate today EFZO,0.3,0.5222222222222221,270,1129,en,2228878592,Andrew Yang,AndrewYang,292213,4707,USA,True
1108366413218103299,2019-03-20,"Heading to Plymouth, New Hampshire today with @marchandsteve!  https://t.co/xIrfD0nDZd come on out and see you soon 👍🇺🇸",Heading Plymouth Hampshire today with xIrfD nDZd come soon,0.0,0.0,62,485,en,2228878592,Andrew Yang,AndrewYang,292213,4707,USA,True
1108344700581355520,2019-03-20,We’re going to have to think a little bigger.,going have think little bigger,-0.09375,0.5,201,1989,en,2228878592,Andrew Yang,AndrewYang,292213,4707,USA,True
1108337697184190464,2019-03-20,This economy stopped working for most people years ago. Unfortunately the winner-take-all dynamics are about to accelerate as technology and capital converge. The question is what to do about it.,This economy stopped working most people years Unfortunately winner take dynamics about accelerate technology capital converge question what about,0.3262,0.75,511,2818,en,2228878592,Andrew Yang,AndrewYang,292213,4707,USA,True
1108322545886027776,2019-03-20,Small but mighty adjustment to my icon 😀 https://t.co/Vu5NWug0h9,Small mighty adjustment icon NWug,0.07500000000000001,0.65,57,834,en,2228878592,Andrew Yang,AndrewYang,292213,4707,USA,True
1108185513645821952,2019-03-20,"The Freedom Dividend is pro-work, not anti-work.  It will create more work in our economy and recognize the work that is already being done. https://t.co/ugIXAeKgci",Freedom Dividend work anti work will create more work economy recognize work that already being done ugIXAeKgci,0.5,0.5,778,2877,en,2228878592,Andrew Yang,AndrewYang,292213,4707,USA,True
1108174785312370688,2019-03-20,My team is amazing - imagine having people whose job it is to make you look good.  I appreciate it every day.  They even got me a haircut.  😀 @Zach_Graumann,team amazing imagine having people whose make look good appreciate every They even haircut,0.65,0.75,65,1298,en,2228878592,Andrew Yang,AndrewYang,292213,4707,USA,True
1108167469582221314,2019-03-20,Never thought I’d be part of a Gang.  Just goes to show.  👍,Never thought part Gang Just goes show,0.0,0.0,1092,8709,en,2228878592,Andrew Yang,AndrewYang,292213,4707,USA,True
1108147447333879808,2019-03-19,Great to see you Austin - be back soon!!  👍😀🇺🇸  Had a blast. https://t.co/BKGLFmh6uA,Great Austin back soon blast BKGLFmh,0.4,0.375,212,1273,en,2228878592,Andrew Yang,AndrewYang,292213,4707,USA,True
1108146755311407105,2019-03-19,Just to clarify - I support the freedom of parents to adopt circumcision for any religious or cultural ritual as desired. Actually have attended a brit milah myself and felt privileged to be there. Thanks Mikael.  Always up to parents.  👍,Just clarify support freedom parents adopt circumcision religious cultural ritual desired Actually have attended brit milah myself felt privileged there Thanks Mikael Always parents,0.07500000000000001,0.16249999999999998,180,2130,en,2228878592,Andrew Yang,AndrewYang,292213,4707,USA,True
1108114387372556289,2019-03-19,"We are experiencing a mental health crisis in America: record levels of anxiety, depression, addiction and even suicide. My brother is a psychology professor and I am passionate about getting more Americans proper resources. I’ll do that as President https://t.co/DmzrPWIWON",experiencing mental health crisis America record levels anxiety depression addiction even suicide brother psychology professor passionate about getting more Americans proper resources that President DmzrPWIWON,0.0875,0.41250000000000003,627,3098,en,2228878592,Andrew Yang,AndrewYang,292213,4707,USA,True
1108102502354960384,2019-03-19,I don’t think tweaking rules is going to save us.,think tweaking rules going save,0.4939,0.0,229,1902,en,2228878592,Andrew Yang,AndrewYang,292213,4707,USA,True
1108082761531830274,2019-03-19,@VanityFair Not quite the cover but I’ll take it.  👍,quite cover take,0.0,0.0,6,218,en,2228878592,Andrew Yang,AndrewYang,292213,4707,USA,True
1108081987057795072,2019-03-19,"RT @VanityFair: “The opposite of Donald Trump,” Yang added during his rally in San Francisco, “is an Asian guy who likes math” https://t.co…",opposite Donald Trump Yang added during rally Francisco Asian likes math,0.4215,0.0,490,0,en,2228878592,Andrew Yang,AndrewYang,292213,4707,USA,True
1108064361208315905,2019-03-19,@NateSilver538 Thanks Nate.  👍🇺🇸,Thanks Nate,0.2,0.2,14,603,en,2228878592,Andrew Yang,AndrewYang,292213,4707,USA,True
1108064319336574976,2019-03-19,"RT @NateSilver538: Andrew Yang has crossed the threshold where we consider him a major candidate, so here's his theory of the case: https:/…",Andrew Yang crossed threshold where consider major candidate here theory case,0.0625,0.5,929,0,en,2228878592,Andrew Yang,AndrewYang,292213,4707,USA,True
1108062681855074309,2019-03-19,Holy crap my Twitter handle just changed to @AndrewYang!  There can be only one.  😀,Holy crap Twitter handle just changed There only,-0.4,0.9,257,3963,en,2228878592,Andrew Yang,AndrewYang,292213,4707,USA,True
1108049355146170370,2019-03-19,We are the richest society in the history of the world - $20 trillion GDP up $5 trillion in the last 12 years alone.  We can easily afford a dividend of $1k/month per adult if that’s what we want to do. Anyone who says we don’t have the money isn’t looking at the right numbers.,richest society history world trillion trillion last years alone easily afford dividend month adult that what want Anyone says have money looking right numbers,0.20476190476190476,0.43392857142857144,1358,6033,en,2228878592,Andrew Yang,AndrewYang,292213,4707,USA,True
1108033310733807617,2019-03-19,The plan is to tell the truth and listen to reason.  That’s the whole plan.,plan tell truth listen reason That whole plan,0.2,0.4,629,3840,en,2228878592,Andrew Yang,AndrewYang,292213,4707,USA,True
1108032763821785088,2019-03-19,Um sold out in 25 minutes.  We get it - more on the way!!  😀👍🥊 Thank you for being such awesome passionate supporters!!  🙏🎉,sold minutes more Thank being such awesome passionate supporters,0.3625,0.7125,85,1471,en,2228878592,Andrew Yang,AndrewYang,292213,4707,USA,True
1108024089040613377,2019-03-19,OUT NOW! Our first hat - the MATH hat. It is a limited first edition print with my signature on the tag. Only 500 available. It will make you better at long division. 👍😄 Visit https://t.co/N9yA84Ui70 https://t.co/ltYkZQb1Li,first MATH limited first edition print with signature Only available will make better long division Visit ltYkZQb,0.18265306122448982,0.44421768707482995,151,1440,en,2228878592,Andrew Yang,AndrewYang,292213,4707,USA,True
1108006820063469569,2019-03-19,Always give yourself a chance to win.,Always give yourself chance,0.25,0.0,248,1687,en,2228878592,Andrew Yang,AndrewYang,292213,4707,USA,True
1108003230775214080,2019-03-19,Karate Kid was my favorite movie growing up https://t.co/FI1Fg8CPpp @CobraKaiSeries,Karate favorite movie growing CPpp,0.5,1.0,44,597,en,2228878592,Andrew Yang,AndrewYang,292213,4707,USA,True
1107991605162770432,2019-03-19,Would Zion Williamson be so epic if his name were Charles?  Parents take note.,Would Zion Williamson epic name were Charles Parents take note,0.1,0.4,177,1335,en,2228878592,Andrew Yang,AndrewYang,292213,4707,USA,True
1107987109472804864,2019-03-19,It's not immigrants. It's automation. https://t.co/e2M7F5KBei,immigrants automation KBei,0.0,0.0,1646,6095,en,2228878592,Andrew Yang,AndrewYang,292213,4707,USA,True
1107976545484922881,2019-03-19,People are the answer not the problem.,People answer problem,-0.4019,0.0,307,2552,en,2228878592,Andrew Yang,AndrewYang,292213,4707,USA,True
1107965603267166208,2019-03-19,Over $1 million raised since Feb 12th!  Thank you for the incredible support!!  👍😀,Over million raised since Thank incredible support,0.9,0.9,91,1004,en,2228878592,Andrew Yang,AndrewYang,292213,4707,USA,True
1107965365731110912,2019-03-19,We’ve raised over $1 million since Feb 12 - THANK YOU for making it happen!  Let’s keep the momentum going!  Tell a friend to donate a buck today.  😀 https://t.co/Gp4E3EFZO0,raised over million since THANK making happen keep momentum going Tell friend donate buck today EFZO,0.7531,0.0,192,1103,en,2228878592,Andrew Yang,AndrewYang,292213,4707,USA,True
1107850233910841344,2019-03-19,Sometimes I think of this race without us in it and it makes me really glad we are doing this thing.,Sometimes think this race without makes really glad doing this thing,0.5,1.0,229,3411,en,2228878592,Andrew Yang,AndrewYang,292213,4707,USA,True
1107847947138596865,2019-03-19,"US rates of incarceration are 4 times higher than most other industrialized countries, and it’s a national disgrace. People on both sides of the aisle now recognize that our system is badly in need of reform. I will make our system less punitive.  https://t.co/C12hPrKZzX",rates incarceration times higher than most other industrialized countries national disgrace People both sides aisle recognize that system badly need reform will make system less punitive hPrKZzX,-0.0483333333333333,0.4216666666666667,357,1964,en,2228878592,Andrew Yang,AndrewYang,292213,4707,USA,True
1107819702791929856,2019-03-19,My father has a PhD in Physics.  I believe in science.,father Physics believe science,0.0,0.0,936,12022,en,2228878592,Andrew Yang,AndrewYang,292213,4707,USA,True
1107816862274994178,2019-03-19,@NateSilver538 Thanks Nate and Galen.  You all do great work 👍🇺🇸,Thanks Nate Galen great work,0.5,0.475,12,390,en,2228878592,Andrew Yang,AndrewYang,292213,4707,USA,True
1107816585409056769,2019-03-19,RT @NateSilver538: On today's podcast we asked whether Andrew Yang or John Hickenlooper is more likely to win the Democratic nomination and…,today podcast asked whether Andrew Yang John Hickenlooper more likely Democratic nomination,0.25,0.75,153,0,en,2228878592,Andrew Yang,AndrewYang,292213,4707,USA,True
1107780134575190017,2019-03-18,Lou on @bemenews on the case for Universal Basic Income. https://t.co/vsqjT2WLSg,case Universal Basic Income vsqjT WLSg,0.0,0.0625,139,693,en,2228878592,Andrew Yang,AndrewYang,292213,4707,USA,True
1107777690067787776,2019-03-18,We all make mistakes.  It’s called humanity.,make mistakes called humanity,-0.3612,0.0,670,4570,en,2228878592,Andrew Yang,AndrewYang,292213,4707,USA,True
1107775352351477760,2019-03-18,Someone today said I’m campaigning for the Federation.,Someone today said campaigning Federation,0.0,0.0,96,1103,en,2228878592,Andrew Yang,AndrewYang,292213,4707,USA,True
1107767936234737664,2019-03-18,Submissions welcome to depose the leader.  Please keep it clean.  😀👍,Submissions welcome depose leader Please keep clean,0.5833333333333334,0.8,29,513,en,2228878592,Andrew Yang,AndrewYang,292213,4707,USA,True
1107763847845343233,2019-03-18,The current leader for best song about me: https://t.co/hiiPQtg0pU @NybergNeil,current leader best song about hiiPQtg,0.5,0.35,70,587,en,2228878592,Andrew Yang,AndrewYang,292213,4707,USA,True
1107757706788655104,2019-03-18,Chicago we are coming your way next Monday!  https://t.co/n6pi6YYIay don’t worry it’s indoors.  👍,Chicago coming your next Monday YYIay worry indoors,-0.4404,0.0,108,660,en,2228878592,Andrew Yang,AndrewYang,292213,4707,USA,True
1107752080977129472,2019-03-18,Criticizing someone for something they wrote as a teenager is stupid.,Criticizing someone something they wrote teenager stupid,-0.7999999999999999,1.0,3492,25804,en,2228878592,Andrew Yang,AndrewYang,292213,4707,USA,True
1107746322118004737,2019-03-18,This may be the most meta campaign for President yet. 😀,This most meta campaign President,0.5,0.5,222,2569,en,2228878592,Andrew Yang,AndrewYang,292213,4707,USA,True
1107707189978951681,2019-03-18,Apparently the incentives for energy efficiency vary greatly across state lines based on differing costs.  If the Federal government were to elevate the incentives in low-cost states it would help spur a reduction in both consumption and pollution.,Apparently incentives energy efficiency vary greatly across state lines based differing costs Federal government were elevate incentives cost states would help spur reduction both consumption pollution,0.42500000000000004,0.55,139,1222,en,2228878592,Andrew Yang,AndrewYang,292213,4707,USA,True
1107691095352397830,2019-03-18,My thoughts on New Zealand and the campaign’s next chapter https://t.co/QY7ZLcjZ5P,thoughts Zealand campaign next chapter ZLcjZ,0.0,0.0,110,561,en,2228878592,Andrew Yang,AndrewYang,292213,4707,USA,True
1107685625833144322,2019-03-18,We are leaving a mess of an economy to the next generation.  We can do much better. https://t.co/fMcnlc1NZf,leaving mess economy next generation much better fMcnlc,0.10833333333333334,0.225,260,1448,en,2228878592,Andrew Yang,AndrewYang,292213,4707,USA,True
1107666913390444546,2019-03-18,Interview with @NYMag https://t.co/Tyf7pJpg0Y thanks @realaxelfoley 👍,Interview with pJpg thanks,0.2,0.2,165,799,en,2228878592,Andrew Yang,AndrewYang,292213,4707,USA,True
1107660268186812422,2019-03-18,"My appearance this morning on @Morning_Joe.  Yes, yes I do.  https://t.co/Iu0QZu6VDB",appearance this morning,0.0,0.0,421,2234,en,2228878592,Andrew Yang,AndrewYang,292213,4707,USA,True
1107638925395460097,2019-03-18,The ratio of days I have makeup on is getting higher.,ratio days have makeup getting higher,0.25,0.5,261,5017,en,2228878592,Andrew Yang,AndrewYang,292213,4707,USA,True
1107611622275719168,2019-03-18,"RT @TheWeek: Andrew Yang is Ross Perot for millennials, says @matthewwalther: https://t.co/ZSuVYX0eiP https://t.co/HcXcVV6tnG",Andrew Yang Ross Perot millennials says ZSuVYX HcXcVV,0.0,0.0,143,0,en,2228878592,Andrew Yang,AndrewYang,292213,4707,USA,True
1107602553825648641,2019-03-18,Scheduled to appear at 8:45 this morning on @Morning_Joe!  Excited for it.  @MSNBC,Scheduled appear this morning Excited,0.375,0.75,147,1222,en,2228878592,Andrew Yang,AndrewYang,292213,4707,USA,True
1107601388333338624,2019-03-18,I remember Ross Perot https://t.co/pN0PZcQYQ9 thanks @matthewwalther @TheWeek,remember Ross Perot PZcQYQ thanks,0.2,0.2,74,478,en,2228878592,Andrew Yang,AndrewYang,292213,4707,USA,True
1107485529422118913,2019-03-18,Thanks to your donations we can focus on spreading the word.  THANK YOU.  I can’t tell you how good it feels to have your support.  Let’s take it all the way.  😀👍🇺🇸,Thanks your donations focus spreading word THANK tell good feels have your support take,0.44999999999999996,0.4,184,1964,en,2228878592,Andrew Yang,AndrewYang,292213,4707,USA,True
1107483978167136256,2019-03-18,Somehow the American people have become underdogs in our own land. That is messed up.  Let’s fix it.,Somehow American people have become underdogs land That messed,-0.34,0.0,1043,6619,en,2228878592,Andrew Yang,AndrewYang,292213,4707,USA,True
1107479248275681281,2019-03-18,A friend sent this to me - my odds of winning the nomination are quite high according to the Internet.  How smart is the Internet?  We will see.  😀 https://t.co/3JDmSdDO32,friend sent this odds winning nomination quite high according Internet smart Internet will JDmSdDO,0.2914285714285714,0.6442857142857142,231,2057,en,2228878592,Andrew Yang,AndrewYang,292213,4707,USA,True
