Tweet ID,Date Created,Tweet,Clean_tweet,Polarity,Subjectivity,Retweets,Favorites,Language,User ID,User Name,User Twitter Handle,Follower Count,Friend Count,Location,Verified
1122234184217636865,2019-04-27,Well this is a cool way to plant trees https://t.co/Nc448AQNI3,Well this cool plant trees AQNI,0.35,0.65,359,1898,en,2228878592,Andrew Yang,AndrewYang,292213,4707,USA,True
1122197019869745152,2019-04-27,This song just came on and someone said this is a pretty good campaign song https://t.co/A9nZ2oIW0e,This song just came someone said this pretty good campaign song,0.475,0.8,52,594,en,2228878592,Andrew Yang,AndrewYang,292213,4707,USA,True
1122191453088776193,2019-04-27,"Campaigning in Stuart, Iowa this morning.  The #YangGang is building everywhere.  👍🇺🇸😀 https://t.co/JLbQt4lC1o",Campaigning Stuart Iowa this morning #YangGang building everywhere JLbQt,0.0,0.0,88,717,en,2228878592,Andrew Yang,AndrewYang,292213,4707,USA,True
1122187878203838464,2019-04-27,Someone just suggested to me that we have a philosopher in the White House.  Great idea.,Someone just suggested that have philosopher White House Great idea,0.4,0.375,464,4581,en,2228878592,Andrew Yang,AndrewYang,292213,4707,USA,True
1122166552760082432,2019-04-27,In Stuart this morning and Des Moines tomorrow at 6:30!  https://t.co/TEVH0AZJFn  Having a blast in Iowa - people here are great.  👍🇺🇸,Stuart this morning Moines tomorrow TEVH AZJFn Having blast Iowa people here great,0.8,0.75,61,388,en,2228878592,Andrew Yang,AndrewYang,292213,4707,USA,True
1122164818948034560,2019-04-27,"RT @Zach_Graumann: #YangGang cracks the Top 10...up from 17

https://t.co/C7O7EbCXwM",#YangGang cracks from EbCXwM,0.0,0.0,296,0,en,2228878592,Andrew Yang,AndrewYang,292213,4707,USA,True
1122153169591721986,2019-04-27,"Iowa we are looking for an individual or family who would benefit from receiving $1,000 a month!  So if you know someone who fits that description please nominate them here.  👍🇺🇸 https://t.co/Wvm8zY3zM6  #HumanityFirst",Iowa looking individual family would benefit from receiving month know someone fits that description please nominate them here #HumanityFirst,0.6486,0.4,155,815,en,2228878592,Andrew Yang,AndrewYang,292213,4707,USA,True
1121953483014451200,2019-04-27,It’s not hard for me to avoid taking money from lobbyists as it’s hard to imagine them backing my campaign.,hard avoid taking money from lobbyists hard imagine them backing campaign,-0.2916666666666667,0.5416666666666666,440,3628,en,2228878592,Andrew Yang,AndrewYang,292213,4707,USA,True
1121949147295309824,2019-04-27,Looks like planting trees could help matters https://t.co/YOO22LmnUG,Looks like planting trees could help matters LmnUG,0.6486,0.0,367,1609,en,2228878592,Andrew Yang,AndrewYang,292213,4707,USA,True
1121948940205809669,2019-04-27,@THEJessAllen Thanks Jess!  😀👍,Thanks Jess,0.2,0.2,3,58,en,2228878592,Andrew Yang,AndrewYang,292213,4707,USA,True
1121948887604973573,2019-04-27,@GarethMFA Thank you Gareth!  That’s amazing 🙏😀,Thank Gareth That amazing,0.6000000000000001,0.9,4,50,en,2228878592,Andrew Yang,AndrewYang,292213,4707,USA,True
1121948755144712192,2019-04-27,"RT @GarethMFA: #YangGang, today and for the next three weeks I'll be going to grocery stores and libraries and restaurants and subway stati…",#YangGang today next three weeks going grocery stores libraries restaurants subway stati,0.0,0.0,144,0,en,2228878592,Andrew Yang,AndrewYang,292213,4707,USA,True
1121948709992972289,2019-04-27,"RT @THEJessAllen: i'm traveling &amp; my bank froze my card

I called to get unblocked, as she was reviewing transactions w/ me, she said ""you…",traveling bank froze card called unblocked reviewing transactions said,0.0,0.0,81,0,en,2228878592,Andrew Yang,AndrewYang,292213,4707,USA,True
1121907201491263489,2019-04-26,"NBA Round 2 predictions: 

Warriors in 6.
Bucks in 6. MVP.
Raptors in 6. 
Nuggets in 7.  I think they get there.  

The Warriors seem like they are tempting fate. But it’s hard to see them losing 4 games. I’m rooting for a new champ all the same.",Round predictions Warriors Bucks Raptors Nuggets think they there Warriors seem like they tempting fate hard them losing games rooting champ same,-0.1638888888888889,0.35555555555555557,60,804,en,2228878592,Andrew Yang,AndrewYang,292213,4707,USA,True
1121900291660533760,2019-04-26,New Policy #29 - Preservation of Public Lands and Water. National parks and our natural resources have been protected for generations for all to enjoy thanks to the vision of our forefathers. We should do the same for future generations. https://t.co/iryWw9RfIY,Policy Preservation Public Lands Water National parks natural resources have been protected generations enjoy thanks vision forefathers should same future generations iryWw RfIY,0.11666666666666665,0.23611111111111113,215,1101,en,2228878592,Andrew Yang,AndrewYang,292213,4707,USA,True
1121864572086910981,2019-04-26,"In all seriousness learned a lot visiting this ethanol processing plant in Gowrie, Iowa.  Very clean and even more potential for renewable fuels.  👍🇺🇸",seriousness learned visiting this ethanol processing plant Gowrie Iowa Very clean even more potential renewable fuels,0.3255555555555556,0.8033333333333333,102,2025,en,2228878592,Andrew Yang,AndrewYang,292213,4707,USA,True
1121864140723773446,2019-04-26,Look at me.  I am the politician now. https://t.co/3fTll4NSef,Look politician fTll NSef,0.0,0.0,381,5052,en,2228878592,Andrew Yang,AndrewYang,292213,4707,USA,True
1121809059349446656,2019-04-26,GDP is a flawed measurement that doesn’t reflect how we are doing. I’d be thrilled to celebrate an uptick in children’s health or a decrease in drug overdoses.,flawed measurement that doesn reflect doing thrilled celebrate uptick children health decrease drug overdoses,0.04999999999999999,0.6,1172,6089,en,2228878592,Andrew Yang,AndrewYang,292213,4707,USA,True
1121807571160113152,2019-04-26,Many publications would make fine businesses with modest margins - but the margins aren’t high enough for public markets or private investors. New models are needed.,Many publications would make fine businesses with modest margins margins aren high enough public markets private investors models needed,0.1680952380952381,0.48309523809523813,48,514,en,2228878592,Andrew Yang,AndrewYang,292213,4707,USA,True
1121806896866967552,2019-04-26,Politicians come to Iowa and talk to local journalists. Meanwhile many of the local papers are going under and journalists are worried about their futures. Every presidential candidate should have a plan to support local journalism as vital to democracy. https://t.co/rWgetu88UO,Politicians come Iowa talk local journalists Meanwhile many local papers going under journalists worried about their futures Every presidential candidate should have plan support local journalism vital democracy rWgetu,0.12,0.18,124,851,en,2228878592,Andrew Yang,AndrewYang,292213,4707,USA,True
1121806126876635137,2019-04-26,Reading the local news to Iowans https://t.co/wi7zPOPMqx,Reading local news Iowans zPOPMqx,0.0,0.0,53,602,en,2228878592,Andrew Yang,AndrewYang,292213,4707,USA,True
1121803101692997633,2019-04-26,Learned a lot in Nevada - including that it is the #1 state in the country in terms of jobs threatened by automation https://t.co/mh3edpbgh6,Learned Nevada including that state country terms jobs threatened automation edpbgh,-0.4588,0.0,80,532,en,2228878592,Andrew Yang,AndrewYang,292213,4707,USA,True
1121780584311861248,2019-04-26,Just added Detroit to the Humanity First Tour next week!  Yes we occasionally add places.  😀🇺🇸 See you soon!  #YangGang https://t.co/TEVH0AZJFn,Just added Detroit Humanity First Tour next week occasionally places soon #YangGang TEVH AZJFn,0.08333333333333333,0.15277777777777776,89,698,en,2228878592,Andrew Yang,AndrewYang,292213,4707,USA,True
1121644097087737856,2019-04-26,I’ve found that if you focus on executing on the things that are under your control the uncontrollable things tend to go your way more often.,found that focus executing things that under your control uncontrollable things tend your more often,0.5,0.5,542,3084,en,2228878592,Andrew Yang,AndrewYang,292213,4707,USA,True
1121624709756416002,2019-04-26,We have some new swag in the store https://t.co/bChtjv6bZp the fun part is someone yelling “YangGang!” at you in public.  😀👍🇺🇸,have some swag store bChtjv part someone yelling YangGang public,0.0,0.06666666666666667,91,619,en,2228878592,Andrew Yang,AndrewYang,292213,4707,USA,True
1121615112677281793,2019-04-26,New Policy #28 - Timing of Payments for Small Businesses. Many small businesses operate month-to-month on cash flow. Meanwhile big companies often bully their contractors by dragging their feet paying bills. Getting paid promptly would help the little guy. https://t.co/yNbXprYt6D,Policy Timing Payments Small Businesses Many small businesses operate month month cash flow Meanwhile companies often bully their contractors dragging their feet paying bills Getting paid promptly would help little yNbXprYt,-0.046875,0.45,176,1116,en,2228878592,Andrew Yang,AndrewYang,292213,4707,USA,True
1121592755879387137,2019-04-26,The Giants should just play Saquon at quarterback.,Giants should just play Saquon quarterback,0.34,0.0,226,1526,en,2228878592,Andrew Yang,AndrewYang,292213,4707,USA,True
1121591271456481280,2019-04-26,@briansmithbeta Thanks Brian 👍🇺🇸,Thanks Brian,0.2,0.2,4,36,en,2228878592,Andrew Yang,AndrewYang,292213,4707,USA,True
1121591237604192256,2019-04-26,"RT @briansmithbeta: Attention #YangGang: if you live or work in Iowa, buy a Yang2020 bumper sticker and drive it everywhere. Buy a MATH hat…",Attention #YangGang live work Iowa Yang bumper sticker drive everywhere MATH,0.13636363636363635,0.5,88,0,en,2228878592,Andrew Yang,AndrewYang,292213,4707,USA,True
1121591024218976257,2019-04-26,RT @Zach_Graumann: #YangGang crashing Andrerson Cooper tonight https://t.co/rCWMhPWTCt,#YangGang crashing Andrerson Cooper tonight rCWMhPWTCt,0.0,0.0,137,0,en,2228878592,Andrew Yang,AndrewYang,292213,4707,USA,True
1121590825706762241,2019-04-26,@parryshen @Zach_Graumann Thanks Parry - great meeting you.  😀🥊👍,Thanks Parry great meeting,0.5,0.475,4,15,en,2228878592,Andrew Yang,AndrewYang,292213,4707,USA,True
1121589485412679681,2019-04-26,The room was filled with hundreds of people not pictured here.  😀🇺🇸,room filled with hundreds people pictured here,0.4,0.9,61,1882,en,2228878592,Andrew Yang,AndrewYang,292213,4707,USA,True
1121589220219531264,2019-04-26,"With @TulsiGabbard speaking to Dems in Dallas County, Iowa. https://t.co/D4Z8bmIXrU",With speaking Dems Dallas County Iowa bmIXrU,0.0,0.0,626,5623,en,2228878592,Andrew Yang,AndrewYang,292213,4707,USA,True
1121568841744703488,2019-04-26,"Sexual orientation and gender identity should be protected classes under the law, receiving all the federal protections afforded under the Constitution and civil rights law.  People don’t choose their orientation or identity.  #HumanityFirst https://t.co/5UoYw65bmk",Sexual orientation gender identity should protected classes under receiving federal protections afforded under Constitution civil rights People choose their orientation identity #HumanityFirst UoYw,0.5,0.8333333333333334,385,1862,en,2228878592,Andrew Yang,AndrewYang,292213,4707,USA,True
1121531414422405122,2019-04-25,I feel like several of my favorite fictional characters are going to movie/tv heaven this weekend.,feel like several favorite fictional characters going movie heaven this weekend,0.16666666666666666,0.4166666666666667,171,1790,en,2228878592,Andrew Yang,AndrewYang,292213,4707,USA,True
1121528953645215746,2019-04-25,"Saying that every organization should “Think like a startup” is dumb. Different types of organizations have different time frames, different goals and different risk tolerances. They also employ different kinds of people. Startups should think like startups.",Saying that every organization should Think like startup dumb Different types organizations have different time frames different goals different risk tolerances They also employ different kinds people Startups should think like startups,-0.0625,0.5833333333333334,171,1629,en,2228878592,Andrew Yang,AndrewYang,292213,4707,USA,True
1121491614067638272,2019-04-25,On the plane to Iowa and someone shouts out “Yang Gang!”  Love it.  😀,plane Iowa someone shouts Yang Gang Love,0.5,0.6,312,4869,en,2228878592,Andrew Yang,AndrewYang,292213,4707,USA,True
1121478685167501312,2019-04-25,"RT @LAmag: Andrew Yang Probably Isn’t Who You Think He Is
https://t.co/nBzhND080D",Andrew Yang Probably Think nBzhND,0.0,0.0,140,0,en,2228878592,Andrew Yang,AndrewYang,292213,4707,USA,True
1121456511450877952,2019-04-25,"RT @AndrewYang: Iowa I am coming your way this week to Sioux City, Stuart and Des Moines!  https://t.co/TEVH0BhkwV see you soon 👍🇺🇸",Iowa coming your this week Sioux City Stuart Moines TEVH BhkwV soon,0.0,0.0,112,0,en,2228878592,Andrew Yang,AndrewYang,292213,4707,USA,True
1121453048826458112,2019-04-25,Glad Joe Biden is running.  This race wouldn’t be the same without him.  👍🇺🇸,Glad Biden running This race wouldn same without,0.25,0.5625,192,3164,en,2228878592,Andrew Yang,AndrewYang,292213,4707,USA,True
1121408963201785856,2019-04-25,Americans were more stressed and angry in 2018 despite positive economic numbers https://t.co/92ripaEbmW,Americans were more stressed angry despite positive economic numbers ripaEbmW,0.10681818181818181,0.5613636363636364,191,1046,en,2228878592,Andrew Yang,AndrewYang,292213,4707,USA,True
1121226253229408256,2019-04-25,The stealth thing that makes you feel your age - when there’s a pro athlete (e.g. Steph Curry) and you’re like “Oh yeah I remember watching his Dad play.” You’ll know what I mean when Bronny goes pro.,stealth thing that makes feel your when there athlete Steph Curry like yeah remember watching play know what mean when Bronny goes,-0.3125,0.6875,80,1140,en,2228878592,Andrew Yang,AndrewYang,292213,4707,USA,True
1121220241416044545,2019-04-25,"Iowa I am coming your way this week to Sioux City, Stuart and Des Moines!  https://t.co/TEVH0BhkwV see you soon 👍🇺🇸",Iowa coming your this week Sioux City Stuart Moines TEVH BhkwV soon,0.0,0.0,112,713,en,2228878592,Andrew Yang,AndrewYang,292213,4707,USA,True
1121201917718171648,2019-04-24,Meeting with labor leaders and workers in Las Vegas. 👍🇺🇸 https://t.co/Z6qCoos1xw,Meeting with labor leaders workers Vegas qCoos,0.0,0.0,97,829,en,2228878592,Andrew Yang,AndrewYang,292213,4707,USA,True
1121201076542136320,2019-04-24,@NateSilver538 Thanks Nate - I do love tacos and think all Americans should have access to good ones.  👍,Thanks Nate love tacos think Americans should have access good ones,0.4666666666666666,0.46666666666666673,105,1611,en,2228878592,Andrew Yang,AndrewYang,292213,4707,USA,True
1121199723870740480,2019-04-24,RT @NateSilver538: Sort of disappointed that @AndrewYang doesn't have a program to subsidize taco trucks in taco-deprived cities. https://t…,Sort disappointed that doesn have program subsidize taco trucks taco deprived cities,-0.75,0.75,84,0,en,2228878592,Andrew Yang,AndrewYang,292213,4707,USA,True
1121171128209121280,2019-04-24,"RT @NiemanLab: Andrew Yang, the most meme-able 2020 candidate, also wants to save journalism https://t.co/vo5ebalNcs",Andrew Yang most meme able candidate also wants save journalism ebalNcs,0.39999999999999997,0.4083333333333334,156,0,en,2228878592,Andrew Yang,AndrewYang,292213,4707,USA,True
1121167824704036864,2019-04-24,"New Policy #27 - Data as a Property Right. Our data is ours. Meanwhile companies know more about us than our own family members and sell and resell our data for their own commercial benefit. If anyone benefits from our data, we should as well. https://t.co/2xkmwmaWoz",Policy Data Property Right data ours Meanwhile companies know more about than family members sell resell data their commercial benefit anyone benefits from data should well xkmwmaWoz,0.2619047619047619,0.3452380952380952,744,2925,en,2228878592,Andrew Yang,AndrewYang,292213,4707,USA,True
1121154722067443712,2019-04-24,"Just visited a prototype for affordable housing units made out of shipping containers that cost about $35,000 each.  Very comfortable. https://t.co/70AY3AYZAf",Just visited prototype affordable housing units made shipping containers that cost about each Very comfortable AYZAf,0.52,1.0,485,4000,en,2228878592,Andrew Yang,AndrewYang,292213,4707,USA,True
1121124949014396928,2019-04-24,"Great time in Las Vegas last night!  #YangGang out in force. 👍🇺🇸 Nevada is the #1 state in terms of jobs facing automation. Retail, gaming, hospitality, call centers, transportation all are losing jobs. https://t.co/oU2wAcd5oU",Great time Vegas last night #YangGang force Nevada state terms jobs facing automation Retail gaming hospitality call centers transportation losing jobs wAcd,0.4,0.4083333333333333,116,877,en,2228878592,Andrew Yang,AndrewYang,292213,4707,USA,True
1121089287745761280,2019-04-24,@xan_desanctis @NRO Thanks Alexandra.  Enjoyed the conversation.  👍,Thanks Alexandra Enjoyed conversation,0.35,0.44999999999999996,2,60,en,2228878592,Andrew Yang,AndrewYang,292213,4707,USA,True
1121089029242380290,2019-04-24,"RT @NRO: The appeal of Andrew Yang's technocratic ideas — some feasible, some not — shows that there are voters interested in non-ideologic…",appeal Andrew Yang technocratic ideas some feasible some shows that there voters interested ideologic,0.25,0.5,141,0,en,2228878592,Andrew Yang,AndrewYang,292213,4707,USA,True
1121087306075500545,2019-04-24,The underemployment rate for college grads is 34% overall and 44% for recent college graduates.  We should stop pretending that college degrees create jobs. They often don’t. https://t.co/OMDCb49zXa,underemployment rate college grads overall recent college graduates should stop pretending that college degrees create jobs They often OMDCb,0.0772,0.125,1902,6371,en,2228878592,Andrew Yang,AndrewYang,292213,4707,USA,True
1121082518466285568,2019-04-24,@JWoodJourno @NiemanLab Thanks Josh 👍,Thanks Josh,0.2,0.2,0,38,en,2228878592,Andrew Yang,AndrewYang,292213,4707,USA,True
1121082470080716800,2019-04-24,RT @JWoodJourno: One 2020 candidate says they want to save journalism in America - and they have a plan. My latest for @NiemanLab https://t…,candidate says they want save journalism America they have plan latest,0.5,0.9,145,0,en,2228878592,Andrew Yang,AndrewYang,292213,4707,USA,True
1121063036507136000,2019-04-24,"RT @SisiLiliDidi: To all the Smart #YangGang  out there, do you know you can become a Super Delegate &amp; give #yang2020 more support? the fir…",Smart #YangGang there know become Super Delegate give #yang more support,0.34920634920634913,0.6031746031746031,105,0,en,2228878592,Andrew Yang,AndrewYang,292213,4707,USA,True
1121062786174316544,2019-04-24,@Aquatic_Mafia Thank you!  😀👍,Thank,0.3612,0.0,3,92,en,2228878592,Andrew Yang,AndrewYang,292213,4707,USA,True
1121062743694438401,2019-04-24,RT @Aquatic_Mafia: Had to do it to ‘um. ♥️😤 #yanggang @AndrewYang https://t.co/stjskshk5L,#yanggang stjskshk,0.0,0.0,102,0,en,2228878592,Andrew Yang,AndrewYang,292213,4707,USA,True
1121050956458647553,2019-04-24,This could be the Damian Lillard postseason.,This could Damian Lillard postseason,0.0,0.0,114,1142,en,2228878592,Andrew Yang,AndrewYang,292213,4707,USA,True
1121046875170197505,2019-04-24,Just found out the new Avengers is 3 hours long - looks like they are going out in style.,Just found Avengers hours long looks like they going style,-0.05,0.4,77,1343,en,2228878592,Andrew Yang,AndrewYang,292213,4707,USA,True
1120860555378454528,2019-04-24,We’re live in Las Vegas NV! https://t.co/mwdY5Z9krJ,live Vegas mwdY,0.13636363636363635,0.5,203,991,en,2228878592,Andrew Yang,AndrewYang,292213,4707,USA,True
1120852234445529088,2019-04-24,MGM replaces bartenders with robots https://t.co/Kgs2gvbjj6 it’s happening before our eyes,replaces bartenders with robots gvbjj happening before eyes,0.0,0.0,327,1020,en,2228878592,Andrew Yang,AndrewYang,292213,4707,USA,True
1120851899211628544,2019-04-24,Nevada is the #1 state for automating jobs https://t.co/sa9TCa9BRz 60% of retail and gaming jobs can be automated away.,Nevada state automating jobs retail gaming jobs automated away,0.0,0.0,166,683,en,2228878592,Andrew Yang,AndrewYang,292213,4707,USA,True
1120848702036377601,2019-04-24,"In 2018, I was told the only way we could tackle the big problems of today would be to create a wave and bring it crashing down on D.C. - We can do it. Challenge Accepted. https://t.co/UKU1zwOapT",told only could tackle problems today would create wave bring crashing down Challenge Accepted zwOapT,-0.07777777777777779,0.6444444444444445,387,1886,en,2228878592,Andrew Yang,AndrewYang,292213,4707,USA,True
1120824654686408706,2019-04-23,Committing a crime shouldn’t make you a non-citizen including your right to vote.,Committing crime shouldn make citizen including your right vote,0.2857142857142857,0.5357142857142857,843,6519,en,2228878592,Andrew Yang,AndrewYang,292213,4707,USA,True
1120779383021633541,2019-04-23,I am the candidate to beat Donald Trump. I am pulling support from the entire political spectrum because I am laser focused on the problems that got him elected and proposing real solutions that would improve people's lives. This campaign will go very far because of it. https://t.co/D1WwqSYqA1,candidate beat Donald Trump pulling support from entire political spectrum because laser focused problems that elected proposing real solutions that would improve people lives This campaign will very because WwqSYqA,0.1,0.33125,826,4156,en,2228878592,Andrew Yang,AndrewYang,292213,4707,USA,True
1120738325520764929,2019-04-23,Our LA rally plus a glimpse of what’s ahead in 2020 https://t.co/0WAAHuewXL,rally plus glimpse what ahead WAAHuewXL,0.0,0.0,55,413,en,2228878592,Andrew Yang,AndrewYang,292213,4707,USA,True
1120734202662490113,2019-04-23,New Policy #26 - Reduce Wildfires.  The massive wildfires out West are the product of drying forests turning into tinder boxes due to climate change. Effective forest management can reduce their frequency and magnitude. We don’t need to accept them. https://t.co/B7LU1Il65J,Policy Reduce Wildfires massive wildfires West product drying forests turning into tinder boxes climate change Effective forest management reduce their frequency magnitude need accept them,0.3,0.9,161,1044,en,2228878592,Andrew Yang,AndrewYang,292213,4707,USA,True
1120732714196332546,2019-04-23,Ah Vegas. So many awkward bachelor party memories.,Vegas many awkward bachelor party memories,-0.04999999999999999,0.75,90,1481,en,2228878592,Andrew Yang,AndrewYang,292213,4707,USA,True
1120723857231368192,2019-04-23,"Now that I’m in Vegas - $1,000 on red. https://t.co/GFtpwklx8G",that Vegas GFtpwklx,0.0,0.0,238,2558,en,2228878592,Andrew Yang,AndrewYang,292213,4707,USA,True
1120722444568842240,2019-04-23,Thank you @danieldaekim for the support!  Been a fan since Lost.  😀#YangGang,Thank support Been since Lost #YangGang,0.4404,0.0,40,562,en,2228878592,Andrew Yang,AndrewYang,292213,4707,USA,True
1120719506530131968,2019-04-23,Shots from LA Rally last night!  #YangGang @LeslieSmith_GF out in full force 😀👍🇺🇸 https://t.co/3xIPTL5Xi8,Shots from Rally last night #YangGang full force xIPTL,0.175,0.30833333333333335,98,735,en,2228878592,Andrew Yang,AndrewYang,292213,4707,USA,True
1120701713571123201,2019-04-23,Seeing old friends on the trail is one of the best parts of running for President. You remember who you are and experiences you shared at different times in your life.,Seeing friends trail best parts running President remember experiences shared different times your life,0.5,0.44999999999999996,61,1009,en,2228878592,Andrew Yang,AndrewYang,292213,4707,USA,True
1120691983716995075,2019-04-23,This reads like the beginning of most every disaster movie I’ve seen https://t.co/ud4SzdP9VC,This reads like beginning most every disaster movie seen SzdP,0.5,0.5,130,717,en,2228878592,Andrew Yang,AndrewYang,292213,4707,USA,True
1120691367179509760,2019-04-23,It’s a few weeks out but our New York rally in Washington Square Park on May 14th promises to be our biggest one yet.  https://t.co/QhoGRHHion Let’s show how big the #YangGang is 👍🥊🎉,weeks York rally Washington Square Park promises biggest QhoGRHHion show #YangGang,0.3818,0.0,87,547,en,2228878592,Andrew Yang,AndrewYang,292213,4707,USA,True
1120688027053858817,2019-04-23,"Heading to Las Vegas - what happens there will go everywhere.  😀👍 Almost 1,000 people signed up for our Town Hall tonight!  https://t.co/DDVFiEqgm2",Heading Vegas what happens there will everywhere Almost people signed Town Hall tonight DDVFiEqgm,0.0,0.0,58,498,en,2228878592,Andrew Yang,AndrewYang,292213,4707,USA,True
1120676052441780225,2019-04-23,Power changes your brain wiring over time https://t.co/dCYEb5TmzX suggests term limits could be a good idea,Power changes your brain wiring over time dCYEb TmzX suggests term limits could good idea,0.7,0.6000000000000001,264,1241,en,2228878592,Andrew Yang,AndrewYang,292213,4707,USA,True
1120661773298749440,2019-04-23,"RT @kimra: Hey all you Yangers, as the outside PR agency for @AndrewYang, I can confirm that we have booked Andrew on @BillMaher in early J…",Yangers outside agency confirm that have booked Andrew early,0.05,0.175,211,0,en,2228878592,Andrew Yang,AndrewYang,292213,4707,USA,True
1120661291889086464,2019-04-23,"RT @YangTrainCo: This good boy is now #YangGang 🐾 🇺🇸

Pet bandanas available at https://t.co/ebBWiMS1F5 https://t.co/rzssqOg02s",This good #YangGang bandanas available ebBWiMS rzssqOg,0.55,0.5,69,0,en,2228878592,Andrew Yang,AndrewYang,292213,4707,USA,True
